id,session_dialog,session_persona
K2-32552-CL01121-CP00270-18-02-S2.json,"['나는 6일만에 돌아왔어. 어떻게 지냈어?', '누구? 가족들이 그러는 거야?', '그렇군. 중국어는 어렵다고 들었어.', '그래? 정말 힘들겠다. 나도 좀 힘들었어.', '내가 최근에 3년 전 일을 생각하면 죄책감이 들어.', '엄마가 그때 한창 홈쇼핑으로 구매를 많이 하셨었는데, 반품도 많이 하셔서 내가 뭐라 그랬잖아.', '응, 거의 안 해. 하지만 그건 우리 가족들을 생각해서 구매한 것들이 대부분이야.', '그래서 요즘 추석이 다가오니 그때가 생각나는데 조만간 좀 잘 대접을 해드릴게.', '응, 얘기 들어줘서 고마워. 그럼 난 가볼게. 수고해.']",['[no_persona]']
K2-16881-CL00969-CP01392-12-10-S2.json,"['나도 20대 남자야.', '호캉스면 호텔에 놀러가고 쉬는거야?', '그럼 멀리 갈것도 없겠네. 집앞에 가.', '나는 티비 예능을 좋아하지만 집에서도 볼 수 있어.', '그런 쓸데없는거 할 시간에 힘들게 간호사일하는 우리 어머니나 보러 가야겠어.', '호캉스 갈 시간에 가족 보러가면 어때?', '그럴지도 모르지만 핑계로는 최악이네.', '그럼 열심히 일해. 나는 남는 시간에 부모님이나 보러 가야겠다.']","['나는 티브이 예능을 좋아한다.', '내 어머니는 간호사이다.']"
K2-30183-CL01841-CP03560-08-08-S2.json,"['안녕, 나는 서울 사는 20대 여자야.', '팝음악 엄청 감성적이네.', '점심은 먹었어? 나는 팟타이를 좋아해서 또 팟타이를 먹었어.', '나는 면요리라면 다 좋아해.', '필승조합이네, 맛잘알이야.', '맞아. 좋아하는 거 하는 게 최고지.', '그나저나 난 부동산 투자에 관심이 없는데 친구가 옆에서 계속 같이 하자고 해.', '나는 하나도 모르는데, 계속 같이 투자하자고 해. 잠시만 기다려줘.']","['나는 서울에 산다', '나는 팟타이를 좋아한다. 나는 또 팟타이를 먹었다.', '나는 면요리를 좋아한다.', '나는 부동산 투자에 관심이 없다. 친구가 계속 같이 투자하자고 꼬신다.']"
K5-02332-CL72552-CP20884-19-02-S2.json,"['안녕, 나는 20대 남자야. 반가워.', '나는 학원 논술 강사야. 너는?', '오, 그렇구나. 우리 아버지도 의사인데, 같은 직종이라고 해야할까?', '피부과 진료 받아봐, 아버지 덕분에 내 피부는 꿀피부야.', '응, 나는 피부과를 안 가도 아버지가 집에서 진료를 해주셔.', '네 주변 여자인 친구들도 나를 부러워해.', '응, 아까도 말했듯이 완전 꿀 피부야.', '아 그래? 아버지 집에 오시면 어떻게 해야할지 물어볼게.', '응 선생님 나도 수업하러 다녀올게. 다음에 다시 대화나눠.']","['나는 학원 논술 강사이다.', '나의 아버지는 의사이다.', '나의 아버지의 진료과목은 피부과이다.', '나는 피부과에 안가도 아버지가 집에서 진료해준다.', '나는 꿀피부이다.']"
K2-06312-CL01419-CP01246-17-14-S2.json,"['안녕, 어제 바로 상품이 배달 됐을텐데 잘 갔어?', '다행이네. 오늘 날씨가 좋은데 뭐하고 있어?', '그렇군. 나도 어머니가 식물을 좋아해서 몇 개 키우고 있어.', '우리 어머니가 요리사셔서 바질이나 허브 같은 걸 키워.', '마음에 여유가 없이 일만 하셔서 그럴 수도 있어.', '나는 최근에 야근을 자주해서 괴로웠는데 오후에 낮잠을 미리 자두니까 마음이 편해졌거든.', '응. 잠이 부족하면 사람이 예민해지잖아.', '응. 그러면 다음에 또 좋은 상품 있으면 전화할게.']","['나의 어머니는 식물을 좋아한다.', '나의 어머니는 요리사이다. 나는 바질과 허브를 키운다.', '나는 야근을 하는 게 괴롭다. 나는 오후에 낮잠을 잔다.']"
K2-23796-CL11408-CP52110-10-04-S2.json,"['안녕, 나는 10대 여성이야.', '안녕, 50대면 주부야? 우리 어머니도 주부야.', '나는 바나나를 좋아해. 자식에게 위인전기를 자주 읽어줘? 나는 위인전기를 읽는 것을 좋아해.', '홈페이지명을 많이 보는구나. 나는 홈페이지명을 하도 많이 봐서 머리를 안쓰게 된 것 같아. 요즘은 잘 안봐.', '맞아, 안타깝다. 혹시 자녀분의 진로가 있어? 나는 기계공학과에 진학하고 싶어.', '굉장히 디테일한 진로를 생각하고 있네.', '그러면 나 같으면 용돈기입장을 진짜 잘 쓸 것 같아.']","['나의 어머니는 주부이시다.', '나는 바나나를 좋아한다. 나는 위인전기 읽는 것을 좋아한다.', '나는 @홈페이지명@를 많이 봤더니 머리를 안 쓰게 되는 거 같아 요즘엔 잘 안 본다.', '나는 기계공학과에 진학하고 싶다.']"
K5-02430-CL73371-CP01298-12-09-S2.json,"['안녕, 지금 대화할 수 있어. 저번에 어머니는 잘 도왔어?', '그랬구나. 연락해줘서 고마워.', '아니, 못 본 것 같아. 어떤 기사?', '나는 영향권 밖의 지역에 살아서 몰랐는데 엄청 큰 피해를 보았네.', '지금 기사를 봤는데 내가 캠핑갔던 곳이라 더 아쉽네. 캠핑 도구에 대해 잘 알아?', '맞아, 사장님께 전화라도 한 통 해드려야겠네.', '그렇군. 대화가 재밌어서 시간 가는 줄 몰랐네.', '응. 그럼 다음에 또 얘기하자.']",['[no_persona]']
K2-24296-CL01243-CP01802-01-03-S2.json,"['안녕, 나는 봉사활동을 하는게 즐거워서. 요즘 봉사활동을 좀 다녀.', '아, 공중보건의사? 군대 대신에 활동하는 거야?', '그렇구나. 결심이 대단하네. 거기는 어르신 환자분이 많지?', '그렇군. 나도 그 다큐 본 적이 있는데, 워낙 지원하는 사람이 적다고 하더라고.', '아 그렇군. 뭔가 3년을 해야 한다는 거에 많이들 부담을 느낀다고 하더라고.', '아, 약간 짧고 굵게와 길고 가늘게 느낌이려나?', '와 물고기 키우시는구나. 어떤 물고기 키워?', '오호, 정말 좋겠다!', '다음에 사진도 보여줘! 화이팅이야!']",['나는 봉사활동을 하는 게 즐겁다.']
K2-22528-CL34490-CP35241-06-16-S2.json,"['잘 지냈어? 11시간만이네.', '정말? 어떤 고민 상담이었는지 알려줄 수 있어?', '아무래도 30대면 좀 늦었지만, 그래도 하고 싶다면 응원하는게 맞지 않을까?', '아무래도 기사 자격증이 필요한 경우가 있으니까. 그러면 대학교를 건축공학과쪽으로 생각하는건가?', '나는 바로 대학에 갔어. 혹시 대학에 갔어?', '30대라면 적당히 공부하면서 동기들 밥 사주거나 하면 인기가 좋을거야. 20대 초반 입장에서는 완전 어른이잖아.', '나는 좀 잘 한 편이야. 취업도 잘 한 편이고, 선생님이니까.', '응, 임용 시험도 너무 어려웠어.', '괜찮아! 나는 학교를 광주에서 다녔어.', '재능이 없다면 공부를 해서 대학에 가는 것이 맞다고 생각해.', '알겠어. 그러면 다음에 다시 대화하자.']","['나는 고등학교 졸업 후 대학에 바로 입학했다.', '나는 공부를 잘하는 편이다. 나는 취업을 잘한 편이다.', '나는 임용시험이 너무 어려웠다.', '나는 학교를 광주에서 다녔다.', '나는 재능이 있는 것이 아니면 대학을 가는 게 맞다고 생각한다.']"
K2-29004-CL21851-CP22713-01-05-S2.json,"['안녕, 25살 여자야. 너는 몇 살이야?', '나랑 같은 20대네. 뭐 하고 있어?', '그렇구나. 나는 조선해양공학과가 부전공이야. 부전공과제도 열심히 하는 모양이네.', '나는 이상하게 부전공은 그렇게 열심히 못하겠던데 멋있네. 취미는 뭐야?', '나는 자전거를 자주 타. 자전거를 타면 종종 신이 나. 바람이 시원해서.', '비싼건 비싸지만, 나는 중고로 사서 괜찮아. pc게임은 어떤거 해?', '그렇구나. 총 게임을 좋아하네. 언제부터 했어?', '오, 잘 하는 편이야? 나도 다음에 할 때 같이 알려줘.']","['나는 조선해양공학과가 부전공이다.', '나는 부전공을 열심히 하지 않는다.', '나는 자전거를 자주 탄다.']"
K2-26940-CL20622-CP22074-05-07-S2.json,"['그렇군. 나는 주말에 교회를 다녀서 교회에 다녀왔어.', '군대에서는 주말에 종교활동을 많이 하더라고.', '제 남동생도 훈련소 들어가서부터 종교활동을 시작하더라고요.', '그렇겠네. 군대에 들어가는 나이가 항상 식욕이 왕성할때지.', '남자들은 군대에 다녀오면 많이 철이든다고 하지.', '군대에 다녀와서 자기 주변을 잘 정리하는 습관이 들었어.', '훈련소에 있을때도 다녀오고 자주 갔던 기억이 있어.', '남동생이 아들 하나라 부모님이 각별하셨거든.', '그러게. 나도 즐거운 시간이었어. 반가웠어!']","['내 남동생도 훈련소부터 종교활동을 시작했다.', '남동생이 군대 다녀와서 주변 정리하는 습관이 들었다.', '남동생이 아들 하나라 부모님이 각별하셨다.']"
K2-02067-CL22865-CP23351-02-07-S2.json,"['안녕. 오랜만이네. 그동안 잘 지냈어? 난 병원이야.', '그렇군. 나는 집에서는 층간소음 때문에 스트레스를 받아서 잘 안 들어와.', '성남이야. 조금 후미진 동네라 그런지 아파트가 벽이 얇아.', '아니, 성남도 낙후된 곳이 많아. 비슷할거야.', '보통 그렇게 생각하더라. 내 동네는 좋지 않아.', '그런 간단한 방법이 있었네. 나도 좀 해봐야겠어. 아니면 이사를 가던가.', '응, 그럼 다음에 또 봐. 안녕.']",['나의 거주지는 성남이다.']
K2-27824-CL12417-CP51982-09-09-S2.json,"['거의 하루만에 연락하네. 그동안 잘 지냈어?', '나는 요즘 강아지 관련 서적을 읽느라 미처 소설을 읽을 시간이 없었어. 너는 반려동물이 있어?', '오래 키웠네. 몇 살이야? 사실 키우게 된 지 얼마 안 돼서 아는 게 별로 없어. 그래서 공부 중이야.', '오래 함께했네. 아직 아는 것이 없어서 우왕좌왕하고 있어.', '응, 생각보다 해야 할 것들이랑 준비해야 할 것들이 많더라고. 그래서 책을 읽고 있어.', '좋은 정보 고마워. 강아지 미용은 얼마나 자주 데려가?', '낯선 사람의 손길이 스트레스가 될 수 있어. 나도 혹시 강아지가 미용을 하면서 스트레스를 받지는 않을까 걱정이야. 혹시 모르는 것이 생기면 여쭤봐도 될까?']","['나는 요새 강아지 서적을 읽고 있다.', '나는 강아지를 키우기 시작했다.', '나는 강아지 키우기에 대해 공부 중이다.']"
K2-11433-CL21671-CP32294-18-08-S2.json,"['안녕, 반가워. 나는 30대 여성이야.', '아직 저녁은 안 먹었어. 에세이를 읽고 있네. 책을 좋아하나 봐. 나도 책 읽는 것을 좋아하는 편이야. 물론 동화책은 제외하고.', '그러네, 너랑 공통점이 있다니 기분이 좋아서 눈물이 다 나네. 요즘 나이가 들어서 그런지 가끔 이렇게 사소한 일에도 눈물이 나. 너는 무슨 일을 해?', '나는 일어인문학과를 전공해서 그런지 통역 프리랜서 활동을 하고 있어.', '햄스터? 너무 귀여울 것 같아. 나는 애완동물을 키우고 있진 않지만 언젠가는 꼭 키워야지 하는 생각은 늘 가지고 있어.', '맞아. 귀여운 동물을 바라보면 사랑스럽지. 나도 가끔 눈물이 날 때면 친구네 강아지를 보고 오곤 해. 식물을 키우시는구나. 어떤 식물을 키우시는지 물어봐도 될까?', '천량금은 처음 들어봐. 식물을 키우면 부자가 된다는 말은 들어본 적이 있는 것 같아. 그래서 식물이 그려진 그림을 선물하기도 해. 어디에서 읽은 적이 있어. 근데 내가 지금 일이 생겨서 잠시 가봐야겠다.']","['나는 책 읽는 것을 좋아하는 편이다. 나는 동화책을 싫어한다.', '나는 가끔 사소한 일에 눈물이 난다', '나는 일어일문학을 전공했다. 나는 통역 프리랜서이다.', '나는 애완동물을 키워 볼 생각이 있다', '나는 귀여운 동물을 바라보면 사랑스럽다']"
K2-06868-CL10155-CP26257-12-06-S2.json,"['안녕, 수원 사는 10대 남학생이야.', '혹시 지금 어떤 일을 하는 중이야?', '응, 고등학생이야. 나는 반려동물 미용사를 진로로 생각하고 있어. 회사 생활은 어때?', '아쉽게도 부모님이 반려동물을 반대하셔서 성인이 되면 키우려고 해. 고양이는 온순해?', '나는 아무래도 강아지를 미용하고 싶어. 고양이는 손톱이 너무 날카로워서 무서워. 점프도 잘하고 고양이한테 다쳐본 적 있어?', '개는 고양이보다 손이 덜 가? 지금 차안인데 댄스음악 때문에 머리가 아파. 나는 귀가 예민해서 댄스음악을 싫어해.', '발라드는 좋아해. 고양이가 손이 덜 갈 것 같네. 무섭긴 하지만 츤데레라서 키우는 맛이 날 것 같아.']","['나는 수원에 산다.', '나는 고등학생이고 반려동물 미용사를 진로로 생각하고 있다.', '나는 아쉽게도 부모님이 반려동물을 반대하셔서 성인이 되면 키우려고 한다.', '나는 아무래도 강아지를 미용하고 싶다. 나는 고양이는 발톱이 날카로워서 무섭다.', '나는 발라드는 좋아한다.']"
K2-30897-CL21918-CP21301-20-03-S2.json,"['어제는 잘 지냈어? 하루만이네.', '나는 어제 친구들이랑 영화를 봤어.', '애들이 멜로를 보자는데 내가 탑건을 보자해서 탑건을 봤어.', '4DX가 엄청 재밌다는데 그거 꼭 봐야겠다.', '그래서 무조건 봐야한다고 떼를 썼는데 재밌었어.', '오~ 그런거 체험 하는거 좋아해?', '나도 그래. 놀이기구도 좋아해.', '아마 작년인 것 같아. 기억이 잘 안나네.']",['나는 놀이기구를 좋아한다.']
K2-17593-CL24106-CP24783-08-01-S2.json,"['4일만에 연락드리네요! 잘 지내고 있었어?', '나는 요즘 새로운 취미가 생겼어.', '혹시 @브랜드명1@, @브랜드명2@ 기억해?', '맞아, 그거 지금 다 내 손에 있어. 요즘 스마트폰을 수집하고 있어.', '응, 나중에 결혼하면 내 재산을 들고 갈 예정이야.', '곧 결혼해. 예비 신부야.', '나는 4년 동안 연애하고 결혼했어. 선생님은 애인이 있어?', '응, 당연하지. 난 경기도에 살아. 청첩장 줄게. 올 수 있어?', '진짜? 너무 좋은데? 미리 이쁜이 한명이 온다고 밑밥을 깔아둘게.', '괜찮아, 거기서 결혼까지 골인하면 냉장고를 사줄게.']","['나는 스마트폰을 수집한다.', '나는 4년 연애하고 결혼한다.', '나의 거주지는 경기도이다.']"
K2-01143-CL51622-CP22225-06-04-S2.json,"['맞아. 엄청 추웠어. 어떻게 지냈어? 나는 캐나다 유학 준비 막바지야.', '오 곧 수능이라 학생들은 많이 긴장될 것 같아. 입시설명회는 어땠어?', '아이고 너무 속상했겠다. 요즘엔 선행학습을 하지 않는 학생들이 정말 없는 것 같아.', '맞아. 사실 그게 정답이 아닐 수도 있는데 우리나라 현실이 그런 것 같아.', '바뀌는 날이 얼른 왔으면 좋겠다. 인구밀도가 높아서 그런지 경쟁하는 분위기가 빨리 사라지기는 어렵겠지만.', '맞아 나도 들었어. 최저시급이 꽤 높다고 하더라고. 우리나라는 너무 경쟁하는 것만 아니면 살기 좋은 것 같아.', '응, 경쟁은 참 숨막히고 어려워. 난 먼저 휴식을 취하러 갈게.']",['나는 우리나라는 경쟁하는 것만 빼면 살기 좋은 것 같다.']
K2-20170-CL31641-CP32285-06-08-S2.json,"['일이 생겨서 이틀만에 다시 연락하게 됐네. 햄스터는 정말 귀여워. 나도 키워보고 싶어.', '교육에도 좋은가? 나는 그저 햄스터가 귀여워서 키우고싶다는 생각뿐이였어.', '아, 그럴게. 심리적으로 안정감도 느끼고, 나는 집에 혼자 있으면 심리적으로 안정감을 못 느껴.', '응, 결혼해서 아이 둘이 있어. 교육적인 부분에서 어떻게 지도를 해야할지 고민이 많아.', '그래? 자연스럽게 배우는 것이라고 하면 나는 공부하는 분위기를 만들려고 하는데, 이것도 자연스럽게 배우는 느낌일까?', '좋은 생각인 것 같아. 너는 결혼했어?', '교육적인 부분에서 고민이신거야?', '그렇긴 하지. 아, 나는 일정이 있어서 다음에 연락해야 할 것 같아.']","['나는 혼자 있으면 심리적 안정감을 못 느낀다.', '나는 결혼을 하였고 아이가 둘 있다. 또한 아이 교육에 대해 걱정이 있다.', '나는 자연스럽게 공부하는 분위기를 만들고자 한다.']"
K2-11445-CL21807-CP20994-09-02-S2.json,"['안녕, 나는 20대 남자야. 태국 여행을 갈 예정이야.', '아, 내가 태국 음식을 좋아해서. 심지어 태국으로 장가라는 소리도 들었어.', '아니, 태국어는 못해. 대신 영어 공부를 하고 있어. 최근에는 오픽을 준비하고 있어.', '잘 하진 못해. 그래서 요즘 매일 열등감을 느껴. 사실 초등 수준 영단어도 몰랐어. 호랑이? lion?', '부끄럽네. 이래서는 여행은 갈 수 있을까?', '백화점은 나도 영... 그럼 차라리 같이 스터디를 하는 건 어때?', '서점에서 태국어 교재 한 권 사서 갈게.']","['나는 태국 여행에 갈 예정이다.', '나는 타이 음식을 좋아한다.', '나는 오픽 자격증을 준비한다.']"
K2-33443-CL27103-CP27459-16-11-S2.json,"['벌써 2시간이 지났네. 나는 메이크업 영상을 보고 있었어.', '쿨톤 메이크업이야! 내가 쿨톤이거든!', '아니, 나는 단아하고 깔끔한 화장법을 좋아해. 너는?', '오 좋아. 나는 신부 메이크업 꼭 받아보고 싶어.', '친구가 결혼해서 신부 메이크업을 해줬는데, 얼굴에서 윤이 났어.', '맞아. 아 메이크업 할 때 기초가 가장 중요한 거 같지 않아? 기초를 대충 바르면 그 자국 그대로 파운데이션이 뭉치더라고.', '나는 속눈썹이나 쌍커풀 테이프를 활용하는 메이크업 아티스트들이 부러워. 나는 그런 것들을 잘 못 사용하거든.']","['나는 유튜브로 메이크업 영상 보고 있다.', '나는 쿨톤이다.', '나는 단아하고 깔끔한 화장법을 좋아한다.', '나는 신부 메이크업을 꼭 받아보고 싶다.', '나는 메이크업 때 기초가 가장 중요한 거 같다.', '나는 속눈썹이나 쌍꺼풀 테이프를 잘 활용하는 메이크업 아티스트들이 부럽다.']"
K2-14526-CL21784-CP22495-06-08-S2.json,"['안녕? 나는 20대 여자야.', '그렇군. 지금은 뭐하고 있어? 나는 종교활동을 하고 왔어. 내 종교는 개신교야.', '오늘 오후에는 뭐 할 거야?', '나는 사진부 동아리에 관심이 있어서 찾아보려고.', '노래나 음악에 관심이 많으신가봐. 나는 가야금 연주를 가끔 해.', '나는 이제 병원에 가봐야겠네.', '아니요. 그럼 다음에 또 이야기 하자.']","['나의 종교는 개신교이다.', '나는 사진부 동아리에 관심 있다.', '나는 가야금 연주를 가끔 한다.']"
K2-02021-CL51562-CP11959-20-04-S2.json,"['나는 안산에 사는 10대 여성이야.', '나는 자전거를 자주 타. 야구는 멋있는 것 같아.', '좋은 생각인 것 같아. 나는 항공기 조종사를 꿈꾸면서 운동을 시작했어.', '응, 그래서 요새 야채쥬스나 스트레칭을 꾸준히 하면서 자세 정렬을 하고 있어.', '블루베리? 왜 싫어해?', '그럴 수도 있지. 나는 상큼달달한 것을 특히 차가울 때 먹는 것을 좋아해.', '응, 다음에 해보고 그때 또 얘기나누자.']","['나는 안산에 산다.', '나는 자전거를 자주 탄다', '나는 항공기 조종사를 꿈꾸며 운동을 하기 시작했다', '나는 야채주스를 마신다 나는 스트레칭을 꾸준히 한다', '나는 블루베리를 차갑게 먹는 걸 좋아한다']"
K5-01145-CL72047-CP00186-10-01-S2.json,"['엄마가 저녁에 콩나물국밥을 해주신대서 콩나물을 사러 다녀왔어. 2시간 동안 뭐했어?', '운동해? 내가 요즘 운동에 대해서 관심을 갖고 공부해서. 헬스는 약간 지루하던데 괜찮아?', '그래도 헬스장을 다니는 것은 신기하네. 나는 친구랑 배드민턴을 쳐. 배드민턴을 칠 줄 알아?', '내가 배드민턴을 좋아해서 규칙을 잘 알아. 일단 배드민턴을 3게임을 원칙으로 하는 건 알고 있지? 21점을 먼저 받으면 게임을 이기는데, 점수가 20:20으로 듀스가 되면 2점 차이로 먼저 앞선 편이 승리를 해. 점수가 29:29로 동점이 되는 경우에는 30점에 먼저 도달한 편이 이기게 돼.', '아무래도 규칙을 알고 치면 더 재미있어질 것 같아!', '맞아. 그리고 상대방과 함께하는 운동이라서 같은 취미를 공유하기에도 좋은 것 같아. 퇴근은 몇 시야?', '많이 늦지 않아서 다행이네. 볼 영화는 정해뒀어?', '나도 멜로영화는 싫어해서 다이나믹한 영화가 좋더라. 재밌게 보고 명량 후기 전해줘. 이따가 또 대화하자.']","['나는 요즘 운동에 대해서 관심을 갖고 공부한다.', '나는 친구와 배드민턴을 친다.', '나는 배드민턴을 좋아한다. 나는 배드민턴 규칙을 잘 안다.', '나는 멜로 영화를 싫어한다.']"
K2-11136-CL21397-CP20888-02-05-S2.json,"['안녕, 만나서 반가워. 나는 티비보고 있어.', '나는 놀면뭐하니를 봐. 요즘엔 뉴스도 많이 봐.', '응, 금리가 왜 이렇게 오르는지...영끌족들이 불쌍해.', '맞아. 청약은 진짜 사람들 다 넣는 것 같아.', '나도 안 넣길 잘 한 것 같아. 하지만 아직도 집값은 비싸. 집을 사야 하는데.', '맞아. 전세는 금액이 큰데 사기까지 당하면 정말 큰일 나는거 같아.', '좋은 생각이야. 결혼 전까지 부모님 집에 있는게 나아.', '나는 밥먹으러 가볼게. 다음에 또 보자!']","['나는 요즘 뉴스를 많이 본다. 나는 놀면 뭐 하니를 보고 있다.', '나는 대출을 많이 받은 사람들이 불쌍하다.','나는 청약을 넣지 않았다. 아직 집값은 비싸다.', '결혼 전까지 독립을 안 하는 게 낫다.']"
K2-11254-CL20373-CP21146-08-06-S2.json,"['사흘만이네. 그동안 잘 지냈어?', '나는 cc하는 여자친구가 있어.', '신학기부터라 아직 2개월이야.', '아 그래? 나는 보통 우리집으로 불러.', '나보다 오래 되었네. 선배님이시네.', '그렇구나. 나도 비슷해.', '그러게. 어디 좋은 레스토랑이라도 가봐.', '수족관 좋네. 고래가 있는 곳이 있을까?', '돌고래도 좋아. 나도 돌고래 보고싶어.', '응. 나는 이만 과제 하러 갈게.']","['나는 여자 친구가 있다.', '나는 연애한 지 2개월 됐다.']"
K2-01652-CL30417-CP22199-19-05-S2.json,"['안녕, 나는 20대 여성이야.', '나는 요즘, 가끔 짜증이나서 그냥 쉰다.', '그렇구나. 나는 수영을 싫어해.', '좋아하는 음식이 있어? 나는 피자를 좋아해.', '응, 나는 일이 있어서 가봐야 할 것 같아.']","['나는 수영을 싫어한다', '나는 피자를 좋아한다']"
K2-26628-CL20644-CP11630-03-05-S2.json,"['나는 수능시험 끝나면 운전 면허를 딸 생각을 하고 있어. 학원을 알아보고 있었어.', '맞아, 걱정이 많아. 어제 락발라드를 듣는다고 했는데 추천해줄만한 노래가 있어?', '나는 옛날 노래를 좋아해. 요즘 날씨에 옛날 노래가 어울리더라고.', '나는 이름의 어머나를 좋아해.', '우리 부모님이 많이 들어서 익숙한 곡이야.', '맞아. 운전할 때 노래를 자주 들어?', '응, 대화 재밌었어. 조심히 들어가.']","['나는 옛날 노래를 좋아한다.', '나는 @이름@가수의 어머나라는 곡을 좋아한다.', '나의 부모님은 어머나라는 노래를 자주 듣곤 하였다.']"
K2-12514-CL20596-CP22451-02-05-S2.json,"['안녕? 나는 20대 남자야.', '안녕. 지금 뭐하고 있어?', '그렇군. 나는 헬스를 싫어하는데 친구가 같이 하자고 해서 하러 가려고.', '나는 일을 하려고. 나는 영어에 관심이 있는데 바빠서 배울 시간이 없어.', '이번 주말에 뭐 할 계획이야? 나는 친구를 만나서 화해하려고. 내가 매우 고집이 쎄서 자주 친구랑 싸우게 돼.', '하지만 아침은 먹었어?', '나도 아직 안먹었어. 나는 커피만 마실래.', '나는 이제 헬스를 하러 가봐야겠네.', '미안해. 내가 나중에 다시 연락할게.']","['나는 헬스를 싫어한다.', '나는 영어에 관심 있지만 배울 시간이 없다.', '나는 매우 고집이 세다.']"
