id,session_dialog,session_persona
K2-10540-CL12939-CP35150-09-05-S2.json,"['안녕, 잘 지냈어? 2일만이네.', '응, 혹시 반려동물을 키워? 요즘 유기견이 많더라.', '대단하네. 나도 가끔 외로워서 반려동물을 키워보고 싶은데, 유기견을 입양해볼까 고민이 많아.', '맞아. 유기견 봉사활동 같은 것도 많은 것 같아. 나중에 기회가 되면 한번 가봐야겠어.', '요즘 밴드나 알아볼 수 있는 방법들이 많다고 들었어.  찾아보면 될 것 같아.', '맞아, 혼자 가서 할 수 있는 일도 아니야. 한번 알아봐.', '아니, 나도 관심은 있는데, 키우기는 조금 부담이 돼.']","['나는 가끔 외로워서 반려동물을 키워보고 싶다. 나는 유기견 입양에 대해 고민하고 있다.', '나는 반려동물에 관심이 있다. 나는 반려동물을 키우기에 부담이 된다.']"
K2-34114-CL01643-CP00208-06-18-S2.json,"['안녕. 20대 여자야. 반가워.', '아니, 나는 무교야. 너는?', '어떤 일을 하는데 주말에도 일을 해?', '그렇구나. 고생하네. 나는 펀드매니저야. 이번 주말은 편히 쉬고 있어.', '부럽네. 일이 힘들지만 요즘은 그래도 가끔 기쁜일이 생기네.', '일이 있다기 보다는 기분이 좋아지려고 좋아하는 음식들로 기분을 풀곤해.', '딤섬을 좋아해. 그래서 오늘도 딤섬을 먹을 예정이야. 너는 점심 뭐 먹을래?', '안전운전해. 연락해줘.']","['나는 종교가 없다.', '나는 펀드매니저이다.', '나는 좋아하는 음식으로 기분을 푼다.']"
K2-33618-CL20065-CP22132-16-13-S2.json,"['며칠이 지났는지 날짜도 모르겠네. 일주일이 지났어?', '시간이 너무 빨리 가. 잘 지냈어?', '와 콘서트에 맛집이라니 너무 좋으셨겠다!', '그랬구나. 그나저나 혹시 기미에 좋은 화장품 좀 알아?', '고마워. 선배와 후배들에게 사줘야겠네. 생일이라고 들어서.', '그렇지. 이럴 때 보면 사회생활이 쉽지는 않네.', '맞아, 그럼 추천 고마워. 내가 또 연락할게.']",['나는 선후배와 잘 어울리지 않는다.']
K2-19873-CL20525-CP22570-06-09-S2.json,"['응, 선생님은 준비 잘 하고 있어?', '선생님은 왜 가게 되셨는지 여쭤봐도 될까?', '멋있다! 나는 영문학과야.', '그렇기도 하고, 미국 음식을 배워보고 싶기도 해.', '많이 불안하지만, 내가 하고 싶은 일이니까.', '응, 몇 년만 더 기다려줘.', '선생님도 준비 열심히 하고, 건강이 첫번째야.']","['나는 영문학과이다.', '나는 음식을 배우기 위해 미국으로 간다.']"
K2-05407-CL01467-CP01154-14-03-S2.json,"['응, 하긴 했어. 청소하는 게 짜증나. 너는 무슨 영화를 봤어?', '아니, 나는 영화를 별로 안 좋아해.', '아 나는 위인 전기를 좋아해서 위인 전기 봐.', '네 위인 전기도 좀 보고 그래. 얼마나 훌륭한 분들이 많은데.', '아 종교가 있어? 믿음이 장난 아니네.', '아 그래? 나는 나를 믿어. 다 필요없어.', '아 괜찮아. 나는 종교가 필요없어. 지금보다 나를 더 아낄 수가 없어.', '응 예배 잘 가고 전도 하는거면 연락 안 줘도 돼.']","['나는 청소하는 게 짜증 난다.', '나는 영화를 안 좋아한다.', '나는 위인전기 좋아한다 나는 쉴 때 위인전기를 본다.', '나는 종교가 필요 없다.']"
K2-30921-CL01257-CP00998-15-03-S2.json,"['안녕, 나도 20대 남자야.', '그래? 왜 걱정이야? 얼마든지 말해줘.', '아, 그렇구나. 그럼 그럴때는 어떻게 해?', '나는 가족이랑 함께하는 시간이 많아서 가족과 시간을 보내.', '나는 따로 취미가 없어서 바이올린을 배우고싶어.', '나도 좋아. 근데 나는 역사 문화 여행에 관심이 없어.', '원래 그게 좋긴하지. 그리고 여행이 뭐든 다 좋지.', '알겠어. 그럼 식사 맛있게 하고 와.']","['나는 가족과 함께하는 시간이 많다.', '나는 바이올린을 배우고 싶다.', '나는 역사/문화 여행에 관심 없다.']"
K2-06139-CL34296-CP51985-02-02-S2.json,"['안녕, 난 30대 여성이야.', '안녕, 나는 국어교육과를 전공했고 지금은 학원 강사해. 어떤 일을 해?', '나는 승마를 하는데 내가 실외에서 승마하는 것을 좋아하거든. 어떤 운동을 해?', '여러가지 운동을 하네. 건강을 잘 챙기는거 같아. 나는 혈액형이 B형인데, 혈액형은 어떻게 돼?', '응, 나는 몇 번 해본 적이 있어. 어렸을 때 헌혈하고 영화도 보고 좋았어.', '나는 피자나 파스타를 좋아해. 아, 중식도 좋아하네.', '맞아. 내가 먹는 걸 좋아해서 요즘 행복해.', '안녕, 그럼 또 연락할게.']","['나는 국어교육과를 전공했고 학원 강사 일을 하고 있다.', '나는 실외에서 승마하는 것을 좋아한다.', '나는 혈액형이 B 형이다.', '나는 헌혈을 어릴 적에 한 적이 있다.', '나는 피자나 파스타를 좋아한다. 나는 중식도 좋아한다.']"
K2-09442-CL20672-CP22557-16-12-S2.json,"['안녕, 나는 같은 20대이고 여자야.', '나는 사무직에 종사하는데, 자기계발서를 꾸준히 읽으면서 이직을 준비하고 있어.', '내 취업에 대해 어머니와 갈등이 있어서 빨리 취업한 것 뿐이야. 하지만 적성에 맞지 않아서 이직을 준비하고 있어.', '대학생 때는 놀아야 하지 않아? 어디 놀러가고 그러지는 않아?', '사진은 추억이야. 사진을 볼 때마다 첫사랑이 생각나는데, 헤어졌을 때 얼마나 슬펐는지...', '응, 방을 정리하다가 발견했어.', '맞아. 나도 아직까지 못 잊는 거 보면 그렇네.']","['나는 사무직에 종사하지만 자기 계발서를 꾸준히 읽으며 이직 준비 중이다.', '나는 어머니와 갈등에 빨리 취업했다.']"
K2-03246-CL20508-CP22333-10-08-S2.json,"['안녕? 나는 20대 여자야. 내 직업은 영양사야.', '나는 종교 여행을 좋아하는데 다음에 체험 여행 갈 곳을 알아보려고.', '오늘 오후에는 뭐 할 거야?', '그렇군. 나는 재즈 음악을 싫어하는데 친구가 같이 재즈 음악 카페에 가자고 해서 가려고.', '나는 주말에 친구를 만나려고.', '나는 아직 안먹었어. 너는?', '그렇군. 나는 카스테라랑 야채 고로케를 먹을게.', '나도 마침 가봐야 했는데 잘 됐다.', '응. 그렇게 하자. 좋은 하루 보내.']","['나는 영양사이다.', '나는 종교 여행을 좋아한다.', '나는 재즈 음악을 싫어한다.']"
K2-21730-CL20482-CP20869-10-07-S2.json,"['일어났어! 부전공인 국사학 과제라서 열심히 해야돼.', '국사학은 자신있어서 괜찮아. 필라테스를 한지 3개월 됐어.', '그렇긴 한데 요즘은 남자들도 많이 해. 난 직접 운동하는게 좋아.', '응, 잘 안봐. 캐나다 어학 연수를 가도 프리미어리그는 볼 수 있겠네.', '한국에 있는 동안 할 수 있는 것을 많이 해. 이왕이면 어머니와의 갈등도 풀고 가면 좋잖아.', '잘할수 있을거야. 아니면 문자부터 해보자.', '응, 통화하면서 잘 풀어봐. 또 연락해.']","['나는 국사학이 부전공이다.', '나는 필라테스를 한 지 3개월이 됐다.', '나는 운동을 좋아한다.', '나는 스포츠 경기를 안 본다.']"
K2-17064-CL13348-CP35698-14-03-S2.json,"['안녕, 나는 10대 여자야.', '안녕, 나는 게으른 편인데 회계사가 되고 싶어서 공부하고 있어.', '멋지네. 나도 재즈 음악을 자주 들어.', '나도 2월생이야. 책 좋아해? 난 수필을 읽는 것을 싫어해.', '나는 아버지가 연구원이라 책을 달고 사셔서 책이 지겨워졌나봐.', '맞아, 방 하나가 서재야. 책이 정말 많아서 읽을 게 많아.', '맞아, 하지만 다 읽지는 않았어.']","['나는 다소 게으르지만 회계사가 되고 싶어서 공부 중이다', '나는 재즈 음악을 자주 듣는다', '나는 2월생이다 나는 수필 읽는 것을 싫어한다', '나는 아버지가 연구원이다', '나는 방 하나가 서재이다', '나는 책 읽을게 많다']"
K2-15401-CL25886-CP26151-16-06-S2.json,"['안녕, 나는 20대 여성이야.', '안녕, 며칠 전부터 흐려. 그쪽은 어때? 나는 흐린 날을 좋아해.', '그래? 그럼 직업이 뭐야? 나는 안경사야.', '그렇군. 영화 보는 거 좋아해? 나는 심심하면 스포츠 영화를 가끔 봐.', '나도 마찬가지야. 커피 좋아해? 나는 커피를 매일 2잔 이상 마시는 카페인 중독이야.', '나는 복숭아를 정말 좋아해. 혹시 고양이를 키워? 나는 고양이 두 마리를 키워.', '우와, 라쿤을 키우는 사람은 처음 봐. 신기하네.']","['나는 흐린 날을 좋아한다', '나는 안경사다', '나는 심심하면 스포츠 영화를 가끔 본다', '나는 카페인 중독이다', '나는 고양이 두 마리 키운다']"
K2-28287-CL23806-CP24466-02-03-S2.json,"['난 퇴근하고 집에 왔어. 너는 집이 어디야?', '저런, 너무 집에만 있으면 답답하지 않아?', '안나가서 더 싫을 수도 있어. 동네라도 산책 나가봐.', '설마 침대에서도 벗어나지 못하는 것은 아니겠지?', '음... 거실이나 베란다, 집 곳곳?', '그렇군. 침대가 최고이긴 하겠네. 그 노래는 들어봤어?', '넌 집에서 할 수 있는 취미를 찾아봐야겠다.', '맛집은 어때? 요즘 배달도 잘 되지 않아?', '그렇군. 나는 엄마가 불러서 다녀올게.']",['[no_persona]']
K2-30525-CL20644-CP22166-14-10-S2.json,"['안녕, 처음 봐.', '나는 20대 남자야. 서울에 살고 있어.', '최근까지 누나랑 같이 유치원 선생님으로 일하다가 그만뒀어.', '곧 뉴질랜드로 어학연수를 가.', '선생님은 무슨 일을 해?', '정말? 대학생이였어? 대학생일 때 많이 즐겨.', '응, 나는 로맨스 영화를 좋아해. 너는?', '아, 액션 영화를 한 번도 본 적이 없네.']","['나는 서울에 산다.', '누나가 유치원 선생님이다. 나는 일을 관뒀다.', '나는 뉴질랜드로 어학연수를 간다.', '나는 로맨스 영화를 좋아한다.']"
K2-31571-CL21711-CP20779-16-13-S2.json,"['안녕, 나는 20대 여자야. 자기소개 해봐.', '김해에 사는구나. 대학교에 다니는 대학생이야?', '응, 나도 대학생이고 전공은 건축공학을 전공하고 있어.', '그건 건축학과에서 주로 해. 나는 수학적인 계산을 많이 해.', '나는 그냥 공원에서 런닝하는 것 좋아해.', '나는 자기계발서를 가끔 읽는 취미가 있어.', '응, 맞아. 자기계발서도 많이 읽고 도마뱀 관련 책도 많이 읽어.', '도마뱀 한 마리를 키우거든. 그래서 관련 책을 많이 읽어.']","['나는 건축공학을 전공한다.', '나는 수학적인 계산을 많이 한다.', '나는 러닝 하는 걸 좋아한다.', '나는 자기 계발서를 가끔 읽는다.', '나는 도마뱀 관련 책도 읽는다.', '나는 도마뱀 한 마리를 키운다.']"
K5-01653-CL70088-CP80088-19-08-S2.json,"['그 동안 잘 지냈어? 시간이 정말 빨리가네. 2주나 지났어. 요즘에도 일상에서 음악 많이 듣고 있어?', '음악 감독은 오케스트라나 오페라 같은 클래식 음악 단체의 음악 부분의 총 책임자라고 할 수 있어. 또 뮤지컬 같은 공연 예술이나 라이브 공연, 영화 등의 영상 작품 등에서 음악 부문을 책임지고 총괄하는 사람을 말하기도 하고. 어떤 일을 하는지 감이 왔어? 좀 더 자세히 말해줄까?', '그렇게 말해주시니까 정말 고마워요. 음악 감독의 역할에 대해 정말 잘 이해하고 계신 것 같아. 말처럼 음악 감독, 특히 드라마 음악 감독은 해당 음악 그 자체를 위한 음악을 하기보다는 드라마에 어울리는 결의 음악을 찾아내고 제작해야 해. 옷으로 비유를 하자면 맞춤 정장을 맞추는 일이라고 할까? 혹시 음악 감독이 작곡가 뿐만 아니라 관리작의 역할도 한다는 거 알고 있어?', '응, OST를 만들기 위해 작곡팀이 있는데, 음악감독은 작곡팀의 치프 작곡가야. 일반 작곡가들도 있어서 그 분들께 디렉션을 줘. 또 제작부나 연출부에 계신 분들과 소통도 해야해서 곡을 만드는 것 이외에도 신경쓸 일이 많아.', '응, 나도 처음에 감독일을 시작했을 때 생각보다 해야 할 일들이 많아서 당황스러웠어. 선생님은 OST 뿐만 아니라 뮤지컬 음악에도 관심이 많구나.', '요즘에는 어린이 뮤지컬 작품도 좋은 작품들이 참 많은 것 같아. 아이들이 좋아하지?', '뮤지컬 음악 감독은 다른 음악감독들과는 또 다르게 하는 일들이 있는데 알고 있어?', '아 이미 알고 계신 부분도 있네. 관객들도 음악 감독이 지휘를 하는 모습을 볼 수 있어. 또 뮤지컬 감독은 배우 오디션, 보컬 트레이닝도 해. 또 뮤지컬 감독은 연기 뿐 만아니라 안무에도 맞는 음악을 완성해야 해.', '아이러니 하지만 쉴 때도 음악을 들으면서 쉴 때가 많은 것 같아. 쉴 때는 평소에는 잘 듣지 않는 밴드 음악을 듣곤해. 선생님은 쉴 때 어떤 일을 하면서 보내?', '그럴 수 있겠네. 고요한 시간도 때때로 필요하지. 지금도 휴식시간이야?']","['나는 처음 감독일 시작 했을 때, 해야 할 일이 많아 당황했다.', '나는 음악을 들으면서 쉰다. 나는 쉴때는 밴드음악을 듣는다.']"
K2-22252-CL20315-CP20951-17-14-S2.json,"['나는 20대 남자이고 조각가야. 반가워.', '오호, 20대라면 지금 대학생이야?', '부럽네. 언제 갈 예정이야?', '왜? 선생님이 원해서 가는 유학이잖아.', '집 떠나면 그게 제일 걱정일 것 같아. 가족이랑 사이가 좋네.', '나는 가족이랑 만나면 매일 싸우게 돼.', '그렇지, 내가 잘 해야할텐데...에구구, 매일 반성만 하네.']","['나는 조각가이다.', '나는 가족과 매일 싸운다.']"
K2-16243-CL01097-CP01960-18-01-S2.json,"['안녕, 나는 20대 여자야. 잘 부탁해.', '나는 서울에 살고 있어. 어디 살아?', '멀지는 않은 것 같아. 지하철도 있으니까.', '나도 그런 거나 해볼까? 재밌겠네.', '나도 TV에서 종종 봤어.', '헬스를 갈 것 같아. 내가 헬스를 좋아해서.', '헬스를 하니까 뿌듯하기도 하고, 요즘 작은 일에도 기뻐. 교양 있으시네.', '운동해? 응, 천천히 일 보고 와.']","['나는 서울에 거주한다.', '나는 헬스를 좋아한다.', '나는 요즘 작은 일에도 기쁘다.']"
K2-30489-CL25999-CP35123-19-02-S2.json,"['퇴근하고 집에서 쉬고 있었어.', '드라마를 너무 좋아해. 나는 옛날 드라마를 다시 보는 것을 좋아해서 요즘 슬기로운 의사생활을 다시 보고 있어.', '오, 미드를 좋아하시나봐. 나는 미드를 한번도 본 적이 없는데 그렇게 재밌어? 매니아층이 많더라.', '오 프렌즈, 메모해놓을게. 그럼 국내 드라마는 안 봐?', '오 작은 아씨들 @브랜드명@ 순위에 있던데 재밌어?', '요즘 나는 브랜드명이고, 브랜드명1이야. 그래서 이런 서비스가 너무 잘 되어있어서 좋아. 주말에는 티비랑 껌딱지가 되네.', '응, 하지만 난 지금 드라마를 보고 있어. 집중해서 와도 될까?']","['나는 드라마를 좋아한다, 나는 요즘 슬기로운 의사생활을 다시 보고 있다.', '나는 주말에는 @브랜드명@랑 껌딱지가 된다.']"
K2-29746-CL21712-CP21267-19-04-S2.json,"['오, 동갑이네. 나도 23살 남자야. 안녕.', '나는 웹 개발을 하고 있어. 너는?', '아, 그랬구나. 그럼 뭐 취미같은건 있어?', '그렇구나. 나는 클라이밍을 자주 해. 운동을 좋아하거든.', '예술쪽이네. 나와 합치면 예체능이겠네.', '그래? 1년째 사과를 먹는다고? 소묘를 좋아하나봐.', '나는 작은 일에도 기뻐해서 사과만 잘 그려도 좋을거 같아.', '응 그럼 다음에 봐~ 잘 있어.']","['나는 웹 개발을 하고 있다.', '나는 클라이밍을 자주 한다.', '나는 요즘 작은 일에도 기쁘다.']"
K2-18689-CL20543-CP21072-15-02-S2.json,"['응, 다녀왔어. 약을 먹으니까 훨씬 나아졌어.', '오, 태블릿은 얼마나 해?', '18만원이면 가격도 좋은 것 같아. 어디꺼야?', '아, 그 회사 알아. 노트북으로 유명하긴 하지.', '아, 그렇구나. 나도 하나 알아봐야겠다.', '오, 글을 쓰시는구나. 재해 재난은 나도 신경이 많이 쓰이네.', '응, 요즘 재난도 많으니까, 알겠어. 다음에 이야기하자.']",['[no_persona]']
K2-32398-CL20164-CP22216-06-14-S2.json,"['안녕, 20대 남자야. 안녕.', '나는 대학생이야. 심리학과인데 너는?', '그러시구나. 그러면 뭐 좋아해?', '나는 노래를 좋아해서 자주 들어.', '나는 R&B 음악 말고도 좋아하는 편이야. 그건 느끼해서 별로야.', '아. 저 줄서고 멀리 가고 질색이라 대충 먹어.', '연극은 하는데, 동아리는 좀 부담이더라. 관심이 안 가.', '응, 그럼 난 과제하러 갈게.']","['나는 심리학과가 전공이다.', '나는 노래를 좋아한다.', '나는 알앤비를 싫어한다.', '나는 맛집 여행에 관심이 없다.', '나는 연극회 동아리에 관심이 없다.']"
K2-13416-CL01377-CP04676-07-10-S2.json,"['이틀간은 안녕하셨어요 요리사님?', '그러쿤. 우리는 얼마 전에 가족사진을 찍었어.', '우리 남매가 성인되고 처음 찍는 거라서 느낌이 좀 색다르더라고.', '응 맞아. 연구원이신 아버지가 간만에 시간이 나셔서.', '좋던데. 이렇게 또 언제 찍나 싶었어.', '응, 꼭 한 번 찍어봐.', '그럼 나는 이만 가볼게. 사진이 나왔다고 하네.']",['나의 아버지는 연구원이다.']
K2-07893-CL40313-CP11853-04-07-S2.json,"['안녕, 나는 10대 여성이야.', '항공기 조종사라니 멋지네. 내 어머니도 은행원이라는 좋은 직업을 가지고 있어.', '일하면서 여행이라니, 꿈만같은 직업이네. 우리 엄마는 은행원이셔서 하루의 대부분을 늘 은행에서 보내시는데 부럽네.', '여행으로 추천해줄만한 곳이 있어? 가족여행을 가자고 부모님께 말씀드려볼까 해.', '좋은 정보 고마워. 나중에 꼭 가보도록 할게. 국내 여행지도 아직 다 가보지 못했어.', '날씨 운이 따라줘야할텐데, 타지만 가면 늘 비가 왔어.', '응, 난 이만 샤워하러 가봐야겠어. 너도 좋은 밤 보내.']","['나의 어머니는 은행원이다', '나의 어머니는 하루의 대부분을 은행에서 보내신다', '나는 부모님께 가족여행을 가자고 할 것이다', '나는 국내여행도 아직 못 가봤다', '내가 여행을 가면 늘 비가 온다']"
K2-25459-CL20641-CP22161-17-14-S2.json,"['만나서 반가워. 난 20대 여자야.', '아니, 나는 동해는 한 번도 안가봤어. 난 군산에 살아.', '그러시구나. 스트레스를 받을 때 달리면 기분이 좋을 것 같아.', '나는 스트레스를 주말에 캠핑을 가서 푼다.', '맞아, 넌 무슨 일을 해?', '아, 나는 요가강사로 일하고 있어.', '좋은 생각이네, 달리기도 좋아하니까.', '응, 나는 파스타 같은 양식은 별로 안좋아해서, 맛있게 먹고 와.']","['나는 동해에 가보지 않았다. 나는 군산에 산다.', '나는 주말에 캠핑을 가 스트레스를 푼다.', '나는 요가강사이다.', '나는 양식을 싫어한다.']"
K2-08802-CL01899-CP01838-07-04-S2.json,"['5일 지났네. 잘 지냈어?', '저번에 외국 사람들을 잘 만난다고 했는데, 관련 직종이야?', '그렇군. 아무래도 많이 피곤할 것 같아.', '그럼 혹시 피곤함을 해결할 취미 생활이 있어? 궁금해.', '나도 음악 좋아해! 장르는 딱히 가리지 않고 있어.', '혹시 K-POP은 들어봤어?', '응, 잘 알아. 내가 좋아하는 그룹이야.']",['나는 @이름1@을 좋아한다.']
K2-27484-CL31781-CP10737-14-09-S2.json,"['안녕, 오랜만이야. 어떻게 지냈어?', '나도 바쁘게 일하면서 정신이 없었어.', '그렇군. 어떤 식으로 방역에 신경쓰고 있어?', '방역에 힘쓰느라 힘들겠네.', '그렇군. 다들 너무 고생이 많아. 정말 코로나가 빨리 끝났으면 좋겠어.', '맞아, 오늘도 엄청 많은 사람들이 코로나에 걸렸다는 데, 빨리 깨끗한 세상이 되었으면 좋겠어.', '나도 약속이 있어서 나가봐야 할 것 같아. 좋은 하루 보내.']",['[no_persona]']
K5-03326-CL74097-CP20970-06-11-S2.json,"['아 안녕. 네 그럼. 지금 전공 공부하느라 바빠.', '아, 말 안했네. 건축학 전공이야.', '지리학과 좋네. 어떤 일 해?', '아 나도 전공 수업 받고 있는데 똑같은 대학생이었네. 내가 착각했네.', '학업 스트레스를 푸는 방법이 있을까? 나도 스트레스야.', '내가 똥손이라 잘 할 수 있을지 모르겠어. 나는 다시 공부하러 가봐야겠다.', '나도 그러면 가볼게. 다음에 또 보자!']",['나는 건축학 전공이다.']
K2-09298-CL41206-CP11782-08-07-S2.json,"['안녕, 나는 십대 여성이야.', '나는 의정부에 사는 학생이야.', '네 부모님과 같이 살아. 혹시 취미가 있어? 나는 콘솔게임을 하는 것을 좋아해.', '정말 다양한 취미를 가지고 있네. 역사 좋아하는 사람들을 보면 신기해. 나는 물리 과목을 좋아해.', '어려운데 어려운걸 고민해서 푸는게 재밌더라.', '맞아. 나는 오늘 약속이 있어서 먼저 가볼게.', '응 다음에 또 대화하자. 좋은 하루 보내.']","['나는 의정부에 사는 학생이다', '나는 부모님과 같이 살고 코 솔 게임 좋아한다', '나는 물리과목 좋아한다', '나는 어려운 걸 고민해서 푸는 것이 재미있다']"
K2-35078-CL20406-CP22192-03-06-S2.json,"['일은 잘 마무리 됐어? 그랬구나. 피곤하겠다.', '응, 해외여행을 좋아해. 자주 가진 못하지만.', '가장 최근에는 베네수엘라에 다녀왔어.', '싱가폴? 나도 가보고 싶어. 어떤게 있어?', '정말 피곤한 여행이 될 것 같네. 비행기 멀미는 안했어?', '저런, 그런 일이 있었군. 나도 경비행기 아니면 잘 못 느껴.', '맞아, 즐거운 여행보다는 안전한 여행이 우선이야.', '응, 운동 조심해서 다녀와.']","['나는 해외여행을 좋아한다.', '나는 베네수엘라로 여행을 다녀왔다.', '나는 싱가포르에 가길 원한다.']"
K2-19075-CL11264-CP41890-01-02-S2.json,"['거의 2달만이네. 그동안 잘 지냈어?', '응, 차 좋아해. 특히 밀크티를 정말 좋아해. 어떤 차 종류를 먹어?', '맛있지, 유자차. 나는 달지 않은 티를 좋아해. 특히 얼그레이.', '아 많진 않아. 라면 정도 가끔 떡볶이를 좋아해서 만들어본 적도 있어.', '어느 유튜버를 좋아해? 어떤 음식을 해봤어?', '멋있다. 나도 나중에 성인이 되면 자취를 하게 될텐데, 직접 만들어서 먹는 것이 로망이야.', '오늘은 감자탕을 가족들이랑 먹었어. 외식하면서 저녁은 뭐 먹었어?']","['나는 밀크티를 정말 좋아한다', '나는 달지 않은 얼그레이 티를 좋아한다', '나는 가끔 떡볶이를 좋아해서 만들어본 적도 있다']"
K2-15819-CL20318-CP11608-16-13-S2.json,"['안녕, 20대 남자야.', '안녕. 나는 주말에 화장실 청소를 해. 청소 좋아해?', '나도 좋아해! 팝송 좋아하는데, 혹시 들어봤어?', '나는 매우 고집이 세서, 듣는 음악만 들어. 여행도 좋아하는 편이야. 혹시 관심있어?', '나는 힐링 여행을 좋아해. 그래서 내가 흐린 날을 싫어해. 혹시 흐린 날을 좋아해?', '나는 날씨 중에는 맑은 날이 좋아. 혹시 좋아해?', '그것도 좋아. 이제 뭘 할 거야?', '나는 아직 안 먹었어. 이제 슬슬 먹어야지.', '알겠어, 다음에 다시 연락해.']","['나는 주말에 화장실 청소를 한다.', '나는 팝송을 좋아한다.', '나는 매우 고집이 세다. 나는 여행을 좋아한다.', '나는 힐링 여행을 좋아한다. 나는 흐린 날을 싫어한다.', '나는 맑은 날을 좋아한다.']"
K2-28370-CL33552-CP23287-09-07-S2.json,"['나는 컴퓨터 하드웨어 기술자 업무중이야.', '키우고있는 강아지가 접종맞을 때가 되어서 병원가려구.', '응, 맞는 주사랑 먹는 약도 있어서 꼭 챙겨야해.', '집근처에 두군데 있는데 좀 더 꼼꼼히 봐주시는 곳으로 가.', '응, 우리 강아지가 사나운데도 끈기있게 봐줘.', '응, 가서 으르렁거리고 할퀴니까 병원 갈 때 예민해져.', '중간에 한 번 옮기고 쭉 다니고 있어.', '응, 나도 업무하러 가 봐야겠다. 수고해.']","['나는 강아지 접종을 잘 챙긴다.', '나는 꼼꼼한 선생님이 있는 동물병원을 간다.', '나의 강아지는 사납다.', '나는 동물병원에 갈 때 예민하다.']"
