id,session_dialog,session_persona
K2-06540-CL02115-CP01880-14-02-S2.json,"['나는 그냥 집에서 책이나 볼래. 무슨 영화 좋아해?', '범죄영화는 재밌지. 완전 스릴 있잖아. 오히려 무서운 것보다 범죄영화가 더 스릴 넘친다고 생각해.', '책은 책이지만 일반 소설책은 아니고, 좀 특별한 책을 읽어.', '그림책 맞아. 내가 보육교사 보조로 일하고 있어서 가끔 동화책을 읽어.', '아니, 일은 아니고 그냥 참고용으로 동화책을 보고 있었어. 주말에 영화 보는 것 말고 취미가 더 있어?', '섹소폰을 연주해? 언제 한번 들어보고 싶어.', '역시 스트레스 푸는데에는 본인이 좋아하는 취미생활을 하는게 가장 중요한거 같아.', '응, 다음에 섹소폰 연주를 꼭 들려줘. 주말 잘 보내.']","['나는 무서운 영화보다 범죄영화가 더 스릴 넘친다고 생각한다.', '나는 보육교사 보조로 일하고 있으며 가끔 동화책을 읽는다.', '나는 보육교사 보조 일의 참고용으로 동화책을 읽고 있다.', '스트레스 해소엔 취미생활이 중요하다고 생각한다.']"
K2-25748-CL21906-CP22557-17-13-S2.json,"['안녕? 나는 20대 여자야.', '안녕. 지금 뭐하고 있어?', '그렇군. 나는 한국사능력검정 자격증을 준비하고 있어서 공부를 하려고.', '나는 배달 음식을 시켜 먹으려고. 내가 짠 음식을 즐겨먹어서 배달 음식이 입에 잘 맞더라.', '혹시 이번 주말에 뭐 할 계획이야? 나는 집에서 뒹굴거리려고. 나는 매우 게으르거든.', '나는 이제 공부를 하러 가봐야겠네.', '나중에 또 연락하기로 하자.']","['나는 한국사 능력 검정 자격증을 준비한다.', '나는 짠 음식을 즐겨 먹는다.', '나는 매우 게으르다.']"
K2-21044-CL20589-CP22257-16-04-S2.json,"['벌써 5시간 지났네. 이제 강의가 끝나서 멍 때리고 있어.', '체력이 대단하네. 나는 다이어트 하긴 해야되는데 이것저것 핑계대면서 안하고 있어.', '대단해. 다이어트는 잘 돼가? 언제부터 했어?', '하하, 나는 검정색을 싫어하는데 살 찐 이후로 검정색 옷만 찾게 돼.', '양심에 찔리긴 해. 점점 맞는 옷이 없어지고 있어. 산책정도로 될까?', '그렇긴 하지. 얼마나 해?', '오늘은 일단 술약속 있으니 가볼게. 운동 열심히 해!']",['나는 검은색을 싫어한다.']
K2-08202-CL21388-CP20704-16-08-S2.json,"['만나서 반가워. 난 20대 남자야.', '나는 악기는 잘 모르지만 음악을 좋아해서 TV 음악프로그램을 자주 봐.', '그렇구나. 무슨 음식을 먹으러 가?', '나도 맛집을 좋아하는데, 우리 아버지가 택시 운전사셔서 맛집을 많이 데려가주셔.', '내가 한번 물어봐 줄게. 그나저나 과제가 너무 많아서 큰일이야.', '내가 국어국문학이 부전공이다보니 과제가 많은 것 같아.', '응 얼른 가서 끝내야겠어. 다음에 봐!']","['나는 악기를 잘 모른다. 나는 TV 음악 프로그램을 자주 본다.', '나의 아버지는 택시운전사다.', '나는 국어국문학이 부전공이다.']"
K2-04129-CL01913-CP03288-04-05-S2.json,"['안녕, 나는 20대 여자야.', '나는 프로그래머인데, 요즘 너무 바빠.', '응, 프로젝트 막바지라서 연구원인 아버지랑 같이 일해.', '그래? 그럼 너는 뭐 하고 있었어?', '귀엽겠네. 나도 빨리 꾸준히 읽는 수필을 읽고 싶어.', '아직 잘 모르겠네. 내일 되야 알겠어. 주말에는 뭐해?', '그렇구나. 나는 쇼핑도 하고 싶어.', '원피스 하나 살까 하는데, 색은 뭐가 좋을까?', '괜찮을 것 같아. 일단 일 마무리 하러 갈게.']","['나는 시스템 소프트웨어 개발자이다.', '나의 아버지는 연구원이다.', '나는 수필을 꾸준히 읽는다.']"
K2-09135-CL20598-CP22219-20-01-S2.json,"['안녕, 나는 20대 여성이야.', '안녕, 난 국내여행에는 관심이 없고 해외여행을 좋아해.', '베트남과 싱가포르에 다녀왔어.', '멀지 않으니 부담스럽지 않게 다녀올 수 있어. 노란색이라 난 보라색을 좋아해.', '와 정말 흥미로운 옛 이야기네! 한 번 가봐도 좋을 것 같아.', '나는 너무 어렸을 때라 기억이 나지 않아. 할아버지.', '사진이나 영상도 많아? 그게 엄청 많이 남는다고 들었어.']","['나는 국내 여행에 관심이 없다. 나는 해외여행을 좋아한다', '나는 베트남을 가봤다. 나는 싱가포르를 가봤다', '나는 보라색을 좋아한다', '나는 유년기 시절 할아버지가 돌아가셨다']"
K2-30721-CL34294-CP11884-14-04-S2.json,"['범죄 영화를 보고 있었어. 범죄 영화를 보니까 우리나라의 법과 제도에 대해서 다시 한번 생각하게 되더라.', '법과 제도의 사각지대에 놓여 어렵게 크다가 결국 큰 범죄를 저지르게 되는 영화를 봤어. 이게 무조건 허구일 것이란 생각이 안 들더라. 세상 어딘가에선 실제로 이런 마음을 가지고 있는 사람도 있지 않을까 하고 돌아보게 됐어.', '그렇지? 그래서 영화로 재밌게 풀어내는 걸 보면 감독이 참 대단하다는 생각이 들어. 너는 우리나라의 사회 이슈를 보는 데엔 관심이 없는 편이야?', '그렇군. 나는 법과 제도에 관심이 많아서 공부를 하고 싶은데 아무래도 내용이 어렵다 보니까 영화나 드라마 같은 걸 보게 돼.', '맞아, @이름@님이 가끔 보는 다큐멘터리도 법과 제도에 대해 잘 다룬 것도 있지 않아?', '응, 그래도 책보다는 영상이 더 접근하기 쉬울테니 한번 도전해봐.', '전 이만 약속이 있어서 가볼게. 다음에 또 연락해.']",['나는 법과 제도에 관심이 많아서 공부를 하고 싶은데 어려워서 영화나 드라마 같은 걸 보게 된다.']
K2-15086-CL20147-CP22199-10-02-S2.json,"['안녕. 여자친구가 멜로 영화를 보자해서 정말 싫었어.', '야외에서 사진을 찍고 그랬어.', '오늘은 @브랜드명1@ 각 나오는 야경 보러 남산 갔어.', '진짜! 사진이 완전 이뻤어.', '야경이 아이폰이라 그런가  , 14 사전예약한거 받아 찍었어.', '정말? 사진이 13보다 훨씬 나아.', '이번에는 동영상도 잘 찍혔어. 야외활동용으로 정말 좋은 것 같아.']","['나는 멜로 영화를 싫어한다.', '나는 남산을 갔다.']"
K2-00585-CL21683-CP20768-14-08-S2.json,"['안녕, 처음부터 독특하네. 나는 스페인어를 좋아해. 힙합 음악을 가끔 듣는 20대 남자야.', '우리 아빠도 엘비스 프레슬리 좋아하시는데 재미있네. 나는 수학이 제일 좋아.', '나는 사과를 제일 좋아해.', '나는 첼로를 전공하고 지금은 첼리스트로 활동하고 있어.', '나는 영화부 동아리에 관심이 있어서 영화를 자주 봐.', '가장 최근에 헌트를 봤어. 재미있었어.', '나는 약속에 자주 늦는 편인데 고쳐야겠어. 즐거웠어.']","['나는 스페인어를 좋아하고 힙합 음악을 가끔 듣는다.', '나의 아빠도 엘비스 프레슬리 팬이다. 나는 수학이 제일 좋다.', '나는 사과를 제일 좋아한다.', '나는 첼로를 전공했고 지금은 첼리스트로 활동하고 있다.', '나는 영화부 동아리에 관심이 있어서 영화를 자주 본다.', '나는 약속에 자주 늦는 편인데 고쳐야겠다.']"
K2-00205-CL20528-CP51066-15-04-S2.json,"['안녕, 2일만에 연락하네. 날씨가 많이 추워졌어. 이제 정말 가을이 지나가는 것 같아.', '맞아, 아직도 팔이 얼얼하네. 백신 맞았어?', '따로 이유가 있어? 아니면 몸이 굉장히 튼튼해?', '아, 그렇구나. 나도 사실 백신을 그렇게 신봉하지는 않아. 그저 사회가 필요하다고 하니 맞는 것 뿐이야.', '맞아, 하지만 그렇게 따지기에는 너무 많은 것들을 못할 것 같아. 이를테면 신약들 대부분은 100년이 안넘었잖아.', '맞아. 그러면 너무 좋을 것 같아. 당장 급한 불을 끄자고 너무 많은 리스크를 감당하는 것 같아.', '맞아, 백신은 위험 요소가 충분히 있어.']",['[no_persona]']
K2-29076-CL20045-CP20731-15-02-S2.json,"['잘 지내고 있었어. 어떤 뉴스를 말하는 거야?', '태풍이 오는거에 걱정이 되네. 약한 강도였으면 좋겠어.', '작년에는 태풍이 안와서 좋았는데 올해는 강한 태풍이라니 많이 걱정이네.', '내가 보석 감정사로 일 하고 있는데 태풍올때 매장 문을 닫아놔야겠네.', '안전이 제일 중요하지. 비옷이랑 장화도 하나 구입해야겠어. 내가 파란색을 싫어해서 빨간색 우비를 구입해야겠어.', '그래야겠지. 주변 바람에 간판 맞고 크게 다칠 수도 있으니 집에 있을게.', '태풍 조심하고 좋은 하루 보내.']","['나는 보석 감정사이다. 태풍 올 때 매장 문을 닫을 것이다.', '나는 태풍을 대비해 비옷과 장화를 구입할 것이다. 나는 파란색을 싫어해서 빨간색 우비를 구입할 것이다.']"
K2-21455-CL12869-CP12354-18-09-S2.json,"['안녕, 나는 10대 남성이야.', '안녕, 나는 요즘 학원 문제로 어머니와 갈등이 있어서 매일 괴로워.', '나는 수학교육과를 목표로 하고 있어. 나는 스트레스 받을 때 댄스 음악을 자주 들어. 너는 어때?', '나도 자연을 좋아해. @이름@님과 공감대 형성이 잘 되어서 좋아. @이름@님은 좋아하는 과일이나 싫어하는 과일이 있어? 나는 알레르기때문에 키위를 안먹어.', '이름님은 신 과일을 싫어하시는 군요. 나는 신 것도 잘 먹는 편이야. 키위도 알레르기가 없었다면 좋아했을 것 같아.', '나는 당진에 살아. 파주는 한 번도 안가봤네.', '응, 다음에 꼭 가볼게. 지금은 이만 저녁 먹으러 갈게.']","['나는 학원 문제로 어머니와 갈등이 있어 매일 괴롭다.', '나는 수학교육과를 목표로 하고 있다.', '나는 댄스음악을 자주 듣는다.', '나는 자연을 좋아한다', '나는 키위 알레르기가 있어 키위를 안 먹는다.', '나는 당진에 거주한다.']"
K2-07528-CL12839-CP52177-08-08-S2.json,"['안녕, 나는 10대 남성이야.', '나는 빵을 즐겨먹는데, 혹시 좋아하는 음식이 있어?', '떡볶이도 좋지. 나는 음악 듣는 것도 좋아해. 특히 디스코 음악을 좋아해서 친구들에게도 적극적으로 들어보라고 하거든. 음악 듣는 거 좋아해?', '나는 요새 측량사가 되고 싶어서 친구랑 같이 협력해서 공부하고 있어. 그때 음악을 항상 들으면서 공부하는 것 같아.', '동물도 좋지. 나는 키우고 싶어서 부모님에게 적극적으로 키우자고 말하는데, 부모님이 싫어하셔서 못 키우고 있어.', '이번주는 너무 피곤해서 아마 주말은 집에서 쉴 것 같아.', '나는 가끔 친구집에 가면 친구네 집 강아지를 산책 시켜줘. 그러니까 더 키우고 싶더라.']","['나는 빵을 즐겨 먹는다', '나는 디스코 음악을 좋아한다', '나는 측량사가 되고 싶다.', '나는 동물을 좋아하지만 부모님 때문에 못 키우고 있다']"
K2-26914-CL21851-CP20919-12-04-S2.json,"['비행기라니 부럽네. 내가 기계항공공학부가 부전공이라서 비행기 보면 관심이 많이 가.', '그래도 작년에 제주도 여행가서 탔었어.', '국내 여행할때는 가고 싶은 명소들 할인권 같은거 미리 알아봐.', '나는 필리핀 여행 가본적 없어. 태국은 가본적 있는데, 환전이 중요한 것 같아.', '태국에 갈때 미리 한국에서 환전하고 갔었어.', '응, 그래도 환율 조금 체크 해봐야 되는거 아니야?', '기억이 가물가물한데 @브랜드명1@에서 환전했던것 같아.', '응, 일찍 자고 여행 잘 다녀와.']","['나는 기계 항공 공학부가 부전공이다.', '나는 국내 여행할 때 할인권을 미리 알아본다.', '나는 필리핀 여행을 가본 적이 없다. 나는 태국을 가본 적이 있다.', '나는 태국 여행할 때 @브랜드명1@에서 환전했다.']"
K2-23168-CL22019-CP12706-05-08-S2.json,"['응, 나는 학원 갔다 숙제하다보니 시간이 엄청 빨리 갔어.', '네 사촌오빠가 군대에 가있어. 군대에 가면 편지 써줄 생각이야?', '훈련소에 있을 때는 못 쓰지 않아? 그때 인터넷 편지를 써달라고 했었어.', '네, 요즘은 인터넷에 채팅으로 치면 프린터로 뽑아서 준다고 해. 편지 써본 적 있어?', '응, 나도 몇 줄 쓰면 뭐 쓰지 하고 못 쓰겠더라. 장문의 글을 쓰는 사람을 보면 신기해.', '그런걸 아직도 갖고 있다니 부럽네. 나는 이사가면서 다 버렸어.', '완전 사랑꾼이네. 난 점심 먹으러 갈게.']","['나의 사촌오빠는 군대에 갔다.', '나는 사촌오빠가 군대에 있어 인터넷 편지를 써달라 했다.', '나는 요즘 군대는 채팅으로 치면 프린터로 편지를 뽑아준다고 알고 있다.']"
K2-32636-CL02475-CP01828-01-02-S2.json,"['안녕, 나는 20대 여자이고 학생이야.', '나는 서울 살고 있어. 요즘 자주 우울해서 문제야.', '내가 살이 많이 쪄서 우울해. 가끔 필라테스를 하는데 그거로는 안되는 거 같아.', '나는 자극을 받아도 의지가 부족해서 잘 안 돼.', '하긴 하는데 스트레스 받으면 폭식을 해.', '그럼 일단 점심을 직접 만들어봐야겠다!', '응. 조언 고마워. 나도 식사 하고 올게.']","['나는 요즘 살이 많이 쪄서 우울하다. 나의 거주지는 서울이다.', '나는 필라테스를 가끔 한다.']"
K2-26176-CL21934-CP22734-01-04-S2.json,"['벌써 일주일에 반이나 지나갔어. 이번주는 시간 빠르네요.', '나도! 주말에는 나는 항상 야식을 시켜먹어.', '그렇지? 주말에 늦게 자다보니 야식이 필수야. 어떤 야식을 좋아해?', '치킨 맛있지. 나는 좀 독특한 야식을 시켜먹어.', '나는 인도 음식을 즐겨먹어서, 자주 야식으로 먹어.', '내가 맛집 여행을 좋아하는데, 인도음식점에서 맛있게 먹은 이후로 꽂혔어.', '응. 향신료를 좋아하기도 하고, 의외로 야식으로 먹기 부담스럽지 않아.', '다른 야식으로는 매운것도 좋아해서 닭발도 즐겨먹어.', '계란찜도 필수지. 빨리 주말이 돼서 야식 먹고 싶어. 즐거웠어.']","['나는 주말에 야식을 먹는다.', '나는 인도음식을 즐겨먹는다.', '나는 향신료를 좋아한다.', '나는 매운 것도 좋아해서 닭발도 즐겨먹는다.']"
K2-02772-CL23835-CP23621-03-04-S2.json,"['안녕, 나는 20대 여성이야. 반가워.', '나는 요즘 일이 안풀려서 슬퍼. 원하는 곳에 취업하기가 힘들어. 너는 일해?', '고마워! 성격이 매우 긍정적이네.', '좋은 성격이네. 그럼 좋아하는건 뭐야?', '나는 티비 교육프로그램을 좋아해. 배울게 많거든. 그리고 요즘은 사진을 찍는 것을 좋아해서 예쁜 곳을 찾아다녀.', '그러네. 나중에 남양주 사진명소 알려주면 내가 가서 찍어볼게. 식사는 했어?', '일식도 맛있지! 나는 인도음식을 좋아해서 커리 먹으러 갈게. 내가 식사하고 다시 연락할게.']","['나는 요즘, 일이 안 풀려 비통하다.', '나는 tv교육프로그램을 좋아한다. 나는 사진을 찍는 것을 좋아한다.', '나는 인도음식을 좋아한다.']"
K2-06908-CL22057-CP20888-04-06-S2.json,"['안녕, 나도 20대 남자야.', '아니, 난 영어에 관심이 없어. 요즘에는 창업에 관심이 있어서 창업 동아리에 가입했어.', '카페를 생각하고 있어. 요즘에 다들 커피를 마시지 않아?', '열심히 공부해야지! 그래서 동아리 가입한 거야.', '이제 일본 여행도 가능해서 일본 여행은 어때?', '종교가 있어? 그럼 겸사겸사 가보면 좋겠네.', '전 종교가 없는데도 절에 가면 그 특유의 분위기가 좋더라.', '점심 맛있게 먹어! 나도 챙겨 먹어야 겠어.']","['나는 영어에 관심이 없다. 나는 창업 동아리에 참여한다.', '나는 카페를 창업하고 싶다.', '나는 종교가 없다.']"
K2-27474-CL20452-CP20835-05-08-S2.json,"['시간이 참 빠르네요. 벌써 3일이나 지났어.', '응, 내 친구가 군대에서 휴가를 나와서 친구를 만나고 왔어.', '맞아. 군대에 있을때는 편지가 정말 중요하지. 감동도 많이 받았어.', '저만 그런게 아니었네. 특히 나는 친구가 아팠다는 소식을 편지로 전해 받았어.', '응, 친구가 많이 아픈데 군대에서 소식을 들었을때 인생에서 가장 슬펐어.', '맞아. 그래도 군대에서는 항상 배고파서 다 맛있지 않아?', '사과를 그정도로 싫어하네. 힘들었겠다. 오랜만에 군대이야기하니 추억이 나네.', '나도 그래야겠다. 추억 이야기를 하니까 정말 즐거웠어.']",['나는 인생에서 가장 슬펐던 때는 친구가 많이 아프다는 소식을 들었을 때이다.']
K2-34496-CL21545-CP21225-04-04-S2.json,"['안녕, 나는 20대 남자이고 대학을 다녀.', '나는 대학에서 체육학을 전공하는데 농구부동아리에 참여하고 있어.', '아침저녁으로 농구하기 좋아서 동아리에서 자주운동을 해.', '나는 계절중에서 가을을 제일 좋아해. 왜 가을을 싫어해?', '그래? 가을이 우울한 날씨도 많지. 집에서 주로 뭘 해?', '주말에도 할일이 많이있지, 일주일에 한번에 몰아서 빨래를 하나봐.', '나도 다림질하는것을 싫어해서 세탁소에 맡겨.', '나는 평소에 간편복을 많이 입어서 세탁소갈일은 많지는 않아.', '나도 다음에 해야할거같아. 즐거웠어.']","['나는 대학을 다닌다.', '나는 체육학을 전공한다. 나는 농구부 동아리에 참여하고 있다.', '나는 가을을 제일 좋아한다.', '나는 간편복을 많이 입는다.']"
K2-18302-CL24242-CP24718-19-03-S2.json,"['안녕, 나는 20대 여자야. 반가워.', '어디 살아? 나는 진주에 살아.', '그래도 수도권에 사네. 나는 서울로 대학간 친구들 보면 요즘, 자주 열등감을 느껴.', '전공어 중어중문학과야. 교직이수를 해서 교사가 되는 것이 목표인데, 나도 젊을 때 서울에서 생활해보고 싶어.', '주전공이랑 부전공이랑 계열이 아예 다르지 않아?', '그렇군. 나는 진로 관련해서 교직이수 말고 다른 생각은 못 해봤는데 좀 더 생각을 유연하게 해봐야겠어.', '대화하고 나니 한결 마음이 편해졌어. 고마워. 또 연락할게.']","['나의 거주지는 진주이다.', '나는 서울로 대학을 간 친구들을 보면 요즘, 자주 열등감을 느낀다.', '나는 중어중문학을 전공 중이며 교직이수를 마친 후 교사가 되는 게 목표이다. 나는 젊을 때 서울에서 생활해보고 싶다.', '나는 진로와 관련해서 교직이수 말고 다른 생각은 못 해봤으나 좀 더 생각을 유연하게 해 볼 것이다.']"
K2-04300-CL12373-CP52190-07-09-S2.json,"['안녕, 나는 10대 여성이야.', '안녕, 나는 드라마 PD가 되고 싶은 학생이야. 무슨 일을 해? 궁금해.', '공부하는 거 정말 대단해. 나는 다소 게으른 편이라서 공부도 맨날 하다가 말아. 나는 생일이 6월인데 혹시 몇 월에 태어났어?', '여름에 태어났구나. 여름 좋지! 혹시 무슨 음식 좋아해? 나는 김밥을 좋아해.', '맛 때문에 안 좋아해? 아니면 식감 때문이야?', '사과 알러지가 있구나. 나는 고양이 알러지가 있어. 알러지가 정말 사람을 괴롭게 만들지. 그럼 사과 음료같은 것도 알러지 증상이 올라와?', '알러지가 진짜 사람 스트레스 주죠. 나도 고양이 알러지 때문에 고생했었어.', '맞아. 그게 참 사람 괴롭게 해.', '응, 편하게 다음에 시간 될 때 얘기 나눠.']","['나는 드라마 PD가 되고 싶은 학생이다', '나는 다소 게으른 편이다', '나는 생일이 6월이다', '나는 김밥을 좋아한다', '나는 고양이 알레르기가 있다']"
K2-00762-CL11221-CP11875-09-04-S2.json,"['2일만이네. 그동안 어떻게 지냈어?', '나는 반려동물을 키우고 싶은데 부모님이 반대를 하시네. 강아지는 무슨 종류야?', '강아지를 키우고 싶은데, 이제 포기했어.', '그냥 이제 포기했어. 반려동물 용품은 뭐 사려고 해?', '아 그렇구나. 강아지를 키우면 산책도 매일 나가겠네.', '아 그렇구나. 공부할 시간도 많이 부족할 것 같아.', '힘들지만 어쩔 수 없지.', '나도 공부해야겠다. 그럼 다음에 봐.']","['나는 반려동물을 키우고 싶지만 부모님이 반대를 하신다.', '나는 강아지를 키우고 싶지만 포기했다.', '나는 힘들어도 그냥 공부를 한다.']"
K2-16993-CL33668-CP23525-13-04-S2.json,"['나는 20대 후반의 남자이고, 직장을 다니고 있어. 반가워.', '나는 백화점에 가는 것을 좋아해서 백화점에 가는 것이 취미인데, 너의 취미는 뭐야?', '오 그렇군. SF 영화를 좋아하면 왠지 판타지 같은것도 좋아할 것 같아.', '판타지도 엄청 화려하잖아. 그래서 뭔가 좋아할거 같았어.', '나는 영화보다는 TV 보는 것을 좋아하는데, 다른 취미라니 궁금하네.', '그렇군. 주말에 공원에 가서 산책을 하는 거야?', '동네 어르신들한테 인사를 드리는건가 보네. 예의가 바른편이긴 한거 같아.', '네 말을 들으니 상담전문가로 일하는 내 여동생이 생각나서 흐뭇했어.']","['나는 직장인이다.', '나는 백화점에 가는 것을 좋아한다.', '나는 TV 보는 것을 좋아한다.', '나의 여자 형제는 상담전문가이다.']"
K2-08621-CL20183-CP22505-01-08-S2.json,"['안녕! 나는 20대 남자야. 반가워.', '나는 대학생인데 다음주에 어학 연수를 가.', '지금은 1년 계획중이지만 더 있을 수도 있을 것 같아. 나는 뉴질랜드로 어학연수를 가.', '부산 여행 좋지! 체험 여행 할만한게 많이 있을까?', '아 그것도 좋아. 나는 일렉기타 연주를 가끔 하는데 연수 갈때 챙겨가서 외로움을 달래야겠네.', '아무래도 기타를 하니까 그런 것 같아. 하지만 그렇게 잘하지는 못해. 가끔 치는 정도야.', '맞아. 소리가 너무 좋아. 전율이 흘러.', '다음에 언제 기회되면 한번 배워보셔도 재밌을거 같아.']","['나는 대학생이다.', '나는 뉴질랜드로 어학연수를 간다, 1년 정도 계획 중이다.', '나는 일렉기타 연주를 가끔 한다.', '나는 일렉기타 소리가 전율이 흘러서 좋다.']"
K5-02106-CL72548-CP22347-06-10-S2.json,"['세시간만이야. 아직 식사하고 있어? 가족이 4명이네.', '일식을 즐겨 먹어? 남동생과는 몇살 터울이야?', '귀엽겠네. 그 나이에 아직 자격증이나 이런걸 공부하지는 않아?', '음악 공부를 하는군. 악기를 다루는 친구야?', '멋지다. 나는 연주할줄은 모르지만 좋아해. 선생님은 악기를 잘 다뤄? 사실 내가 수업에 대해서 관심을 갖고 공부하고 있어.', '피아노 수업에서 Tramway(철도)라는 곡을 꼭 배운다고 하네. 배웠어?', '멋진데? 나는 40까지 쳤다가 관둔 것 같아. 그냥 가요 듣는 것도 좋아해?', '나도 고마워. 어떤 노래를 좋아해? 아, 저 영화 시간이 돼서 자주 보는 스포츠 영화 좀 보고 올게.']","['나는 요즘 수업에 대해서 관심을 갖고 공부한다.', '나는 어릴적에 체르니 40까지 쳤었다.', '나는 스포츠 영화를 자주 본다.']"
K2-33801-CL20213-CP22163-05-02-S2.json,"['안녕, 나는 20대 남자야. 회사원이야.', '오, 그렇구나. 청춘이네. 대학생활 어때?', '멋지다~ 나는 운동하는 사람이 멋지더라고.', '나는 2년전에 해외 봉사를 다녀왔었어.', '아니, 요즘은 사회에 대한 환멸을 느껴.', '그런 방식이네. 나도 한번 봐볼래.', '나는 호기심이 별로 없어서. 그런건 싫더라.', '응 그럼 좋아하는거 들어야겠다. 다음에 보자.']","['나는 2년 전에 해외 봉사활동을 다녀왔다.', '나는 전자 음악을 싫어한다.']"
K2-29914-CL11111-CP20938-14-02-S2.json,"['39시간만이네. 난 학교를 갔다왔어.', '학생이 그렇죠 뭐. 수행평가로 국내 환경문제에 대해서 발표가 있어서.', '탄소 감소가 왜 중요한지, 국내 환경 문제에 대해서 아는 사례 같은 게 있어?', '그렇군. 나는 분리수거를 열심히 하는데, 이것도 탄소 감소에 도움이 될까?', '그래? 나도 사실 분리수거 기준도 명확하지 않다고 생각해. 공장에 가도 대부분 일반 쓰레기로 버려진다고 하더라고.', '친환경에너지에는 어떤 것들이 있어? 나는 친환경 에너지를 잘 몰라.', '그렇군. 풍력 발전기는 봤었는데 화력은 처음 들어봐. 혹시 원자력 에너지에 대해서는 어떻게 생각해?']","['나는 분리수거를 열심히 한다', '나는 분리수거 기준이 명확하지 않다고 생각한다.', '나는 친환경 에너지를 잘 모른다.']"
