id,session_dialog,session_persona
K2-30238-CL20114-CP20868-08-10-S2.json,"['안녕? 나는 20대 남자야. 나는 부산에 살아.', '나는 힙합음악을 들을거야. 좋아하거든.', '오늘 오후에는 뭐 할 거야?', '그렇군. 나는 합창단 동아리에 관심이 있어서 가보려고.', '딱히 계획은 없어서 집에서 쉴 것 같아.', '응. 아침부터 삼겹살을 먹었어.', '나는 아침, 점심, 저녁 상관없이 먹고 싶은 걸 먹어.', '그렇군. 그러면 얼른 가봐.', '아니요. 괜찮아. 나중에 꼭 다시 연락줘.']","['나의 거주지는 부산이다.', '나는 힙합 음악을 좋아한다.', '나는 합창단 동아리에 관심 있다.']"
K2-34761-CL35861-CP34782-16-07-S2.json,"['나도 체형을 좀 바꿔보려고 운동하고 있어.', '하체하는 날은 정말 힘이 하나도 없어.', '꾸준히 하다보면 언젠가는 변해. 꾸준히가 정말 중요한거 같아.', '단백질도 잘 챙겨 먹어야 해!', '나는 주로 사먹어. 만들어먹기가 너무 귀찮아.', '나는 맛없으면 입에 잘 안 들어간다.', '응 내가 일이 있어서 먼저 가볼게!']",['나는 체형을 바꿔보려고 운동한다.']
K2-08811-CL12459-CP12263-13-08-S2.json,"['3시간이 지나가버렸네. 뭐하는 중이야?', '나는 학원을 다녀왔어. 근데 요즘 갑자기 너무 추워졌어.', '나도 비염이 있어서 힘들어. 감기에 걸리진 않았어?', '영어 학원에 다니고 있어. 요즘은 어딜 가든 영어가 중요하잖아.', '요즘 수험생들을 위한 건강식품도 많이 나와서 챙겨 먹어보려고 해.', '그건 처음 알았네. 평소에 과일을 많이 챙겨먹어?', '귤도 비타민이 많아서 좋은 것 같아. 환절기에 비타민을 잘챙겨먹는 것도 감기 예방에 도움이 된다고 하더라고. 귀찮더라도 꼭 잘챙겨먹어.']","['나는 비염이 있다.', '나는 영어 학원에 다니고 있다', '나는 건강식품을 챙겨 먹으려 한다']"
K2-00857-CL31718-CP30857-13-05-S2.json,"['그래도 효녀네. 귀찮아도 엄마랑 같이 백화점 가는 모습을 보면.', '오늘 주말이잖아. 그래서 오늘 맛집 동호회에 참석하려고 지하철을 타고 있어.', '난 겨울처럼 쌀쌀한 날이야. 그런 날에는 벌레가 잘 없더라고.', '추운 건 그냥 많이 껴입으면 되니까. 그래서 괜찮아.', '난 괜찮아. 하의는 애초에 추위를 잘 안타기도 하고, 상의도 많이 껴입어봤자 3~4겹이라서. 그래서 딱히 불편하진 않아.', '더위도 그리 타지는 않아. 그런데 더운 날씨에는 벌레가... 그건 못참지.', '꼭 그렇지만은 않은 것 같아. 여름에는 장마랑 태풍이 있잖아.']","['나는 쌀쌀한 날을 좋아한다.', '나는 추위를 잘 안 탄다.', '나는 더위를 많이 타지 않는다.']"
K2-10977-CL13193-CP10599-06-01-S2.json,"['안녕. 10대 여성이야.', '나는 남양주에 살고있는데 어디 살아?', '나는 미술교육과에 진학하고 싶은데 꿈이 있어?', '응, 그래서 가끔 고마워. 나는 팝 음악을 좋아하는데 취미가 있어?', '나는 일식을 안먹는데 다른 음식은 다 좋아해. 좋아하는 음식은 뭐야?', '나는 매운걸 잘 못먹는데 떡볶이는 포기 못하겠어.', '응, 나 이만 점심 먹으러 가볼게. 다음에 또 대화하자.']","['나는 남양주에 살고 있다.', '나는 미술교육과에 진학하고 싶다.', '나는 팝 음악을 좋아한다.', '나는 일식을 좋아하지 않는다.', '나는 매운 걸 못 먹고 떡볶이는 좋아한다.']"
K2-24850-CL21812-CP21200-02-07-S2.json,"['통화를 좀 길게 했었네. 라쿤을 키우고싶다고 했는데, 어쩌다가 키우고싶어졌어?', '그런 계기가 있었구나. 나는 집에서 반려동물 키우는 것은 반대해.', '우리 윗집에서 강아지를 키우는데, 층간소음이 심해.', '맞아. 층간소음 문제를 겪어본 적 있어?', '그런가? 나는 층간소음때문에 편히 쉴 수가 없어.', '응. 잘 못쉬어서 그런지 요즘, 가끔 초조해. 정신적으로 무리가 오는 것 같아.', '그렇지? 점심때가 지났는데 점심식사는 했어?', '나는 한식을 싫어해서 김치찌개는 별로야. 다음에 또 대화하자.']","['나는 집에서 반려동물 키우는 것을 반대한다.', '나의 윗집에서 강아지를 키운다.', '나는 층간소음 때문에 편히 쉴 수가 없다.', '나는 한식을 싫어한다.']"
K2-06433-CL12525-CP12580-07-11-S2.json,"['일주일 만이네. 그동안 잘 지냈어?', '나는 게임을 하고 있었어. 내가 PC게임을 자주 하잖아. 너는 뭘 하고 있었어?', '나는 천천히 하고 싶어. 뭔가 어렸을 때 해볼 수 있는 것들은 다 해보고 결혼하고 싶어. 너는 어때?', '그래? 요즘에 생각이 바뀐 이유가 있어?', '아 그래? 그럼 결혼하지 않고 아이를 갖고 싶다는 말일까?', '그렇군. 나는 반대로 자녀는 없어도 되는데 결혼을 하고 싶어.', '어머, 나는 혹시라도 쌍둥이를 낳게되면 키울 수 있을 것 같아.', '응, 시간 될 때 또 얘기 나누자.']","['나는 결혼을 천천히 하고 싶다.', '나는 자녀가 없어도 된다.', '나는 쌍둥이 낳고 싶다.']"
K2-35381-CL23126-CP23369-13-08-S2.json,"['나는 오늘 영어영문학 전공 수업을 다 듣고 집에 가고 있어. 일하고 있어?', '오늘 친구분과 술약속이 있으신가봐. 오늘도 위스키 마셔?', '나는 술은 못마셔. 술 대신 카푸치노를 좋아해서 자주 마셔. 커피는 좋아해?', '맞아? 오늘 집 오는 길이 추웠어. 평소에 새에 관심이 없어서 몰랐는데 오늘 집 오는 길에 새가 한마리도 안보였어.', '나는 비염이 있어서 환절기가 힘들더라. 비염 있어?', '비염이 없는 것은 축복 받은거야. 비염이 있는 사람은 정말 고통스러워.', '나는 이제 집에 도착해서 샤워하러 가볼게.']","['나는 술을 못 마신다. 나는 카푸치노를 좋아한다.', '나는 평소에 새에 관심이 없다. 집 오는 길에 새가 한 마리도 안 보인다.', '나는 비염이 있어서 환절기가 힘들다.']"
K2-05984-CL20333-CP20906-04-02-S2.json,"['안녕, 나는 20대 남자야. 너는?', '랜덤채팅에서 같은 20대 남자분을 만나는 건 오랜만이라 반갑네.', '내가 새로운 사람과 잘 사귀어서, 랜덤채팅이 재밌어.', '저 1년 전에 등록한 미술 학원을 꾸준히 다니고 있어.', '그거 따두면 유용하지. 나도 공부하는 게 뭐 있을까. 드럼을 연구하는데, 이것도 공부로 쳐줘?', '응, 대학 때 밴드부를 했었어.', '아직도 밴드를 하고 싶은데, 요즘 주변이 다 바빠서 드럼을 쳐본지도 오래 됐네.', '응, 맞아. 아, 난 알바 시간이 돼서 가봐야 할 것 같아.']","['나는 새로운 사람과 잘 사귄다. 나는 랜덤 채팅하는 게 재밌다.', '나는 1년 전에 미술 학원을 등록했다.', '나는 드럼 연구를 가끔 한다.', '나는 대학 때 밴드부를 했었다.', '나의 주변은 바빠서 같이 밴드를 하지 못한다.']"
K2-11361-CL21834-CP21128-03-02-S2.json,"['안녕, 난 20대 여자야. 너는?', '나는 요즘 과거 추억이 생각이 나서 좀 슬프기도 해.', '내 인생에서 가장 슬펐던 순간은 첫사랑과 헤어졌던 때야.', '아니, 이제 더 이상은 연락을 하고 있지 않아. 너무 슬퍼.', '그럴까? 사실 요즘, 주로 카톡으로 이야기를 하기는 해.', '보통 영화에 대한 내용을 좀 이야기를 하는 편이야. 둘 다 영화를 좋아하거든.', '나는 그런데 걱정이 되는게, 그 사람이 자꾸 음악 영화를 얘기해. 나는 싫어하거든.']","['나는 인생에서 가장 슬펐던 때는 첫사랑과 헤어졌던 때이다.', '나는 주로 카톡으로 이야기를 한다.', '나는 음악 영화를 싫어한다.']"
K2-33126-CL00145-CP01410-05-11-S2.json,"['하...병장 달고부터 요즘 매일 짜증이 나.', '병장 달고 일이 줄었으면 했는데, 내가 싫어하는 커피도 계속 타야하고 복장 지적도 받고...', '날이 추워서 웃옷을 입고 돌아다녔더니 행정반에서 불러서 지적을 받았어. 너는 군필이야?', '응, 깔깔이가 예쁘지도 않은데 입는건 살려고 입는건데 너무하네. 깔깔이를 입어봤어?', '파란색이라니, 상상도 안된다.', '하지만 실제 전시상황에서는 파란색은 눈에 잘 보여서 위험해. 직접 만드는 것도 좋을 것 같아.', '저 이제 핸드폰 낼 시간이네. 즐거웠어.']",[ '나는 커피를 싫어한다.']
K2-15743-CL21553-CP21201-17-03-S2.json,"['시원시원한 성격을 가진 20대 남자야.', '화상이 심하진 않아야 할텐데 나도 술먹고 자전거 타다가 넘어져서 부상당했어.', '그러게...이번에 다치고 다시한번 느꼈어. 나는 맥주를 좋아해.', '나는 언제든 환영이야. 그런데 건강을 위해 술은 좀 줄이긴 해야겠어.', '건강을 위해 간에 좋은 비타민이라도 챙겨 먹어!', '나는 시원한 곳에서 TV 보며 맥주한잔 하는 순간이 가장 좋아.', '나는 봉사활동 하는 것을 싫어해.', '네 기회되면 언젠가 한번은 해보도록 할게.', '응 잘 하고 와. 잠시 후 다시 대화 하자.']","['나는 맥주를 좋아한다.', '나는 봉사활동을 하는 것을 싫어한다.']"
K2-21356-CL10313-CP22585-13-01-S2.json,"['안녕, 나는 10대 남성이야.', '나는 아직 고등학생이라 학교를 다니고 있어. 요즘 부모님하고 자주 싸워서 힘들어.', '이제 고등학생이다 보니 학업 문제로 자주 싸우게 돼. 나는 성격이 털털한 편이라 친구들하고는 싸운 적이 없는데, 요즘은 학업 스트레스 때문에 별거 아닌 일에도 부모님이랑 싸우게 돼.', '나는 판타지 영화를 즐겨보는 편이야.', '신비한 동물사전을 재미있게 봤어. 신비로운 동물들이 많이 나와서 신기했어.', '그래? 나중에 시간이 되면 한번 찾아봐야겠네.', '아 그렇군. 연기를 잘하다보니 재밌을 것 같아.']","['나는 아직 고등학생이라 학교를 다니고 있고 부모님과 자주 싸워서 힘들다.', '나는 학업문제로 자주 부모님과 부딪힌다.', '나는 판타지 영화를 즐겨본다.', '나는 신비한 동물사전을 재미있게 봤다.']"
K2-20354-CL24055-CP24680-10-01-S2.json,"['그렇구나, 난 카페에서 카페라떼를 마셨어.', '나는 운동을 좋아해. 너는 운동을 좋아해?', '그렇구나. 나는 테니스를 좋아해. 테니스를 해본 적 있어?', '응, 엄청 재미있어. 그리고 운동도 잘 되는 것 같아. 그럼 너는 배구 직접 해본 적 있어?', '오, 정말? 나는 배구는 한번도 안해봤어. 배구는 어렵지 않아?', '응, 친구가 배구를 좋아해서 같이 배구경기를 본 적이 있어.', '응, 직접 보니깐 재미있었어. 근데 생각보다 공이 빨라서 놀랐어.', '아니, 테니스는 쳐보기만 하고 경기는 보러간적이 없어.', '그럴려고! 테니스 경기를 보고나면 어땠는지 말해줄게.']","['나는 운동을 좋아한다.', '나는 테니스를 좋아한다.', '나는 배구를 해본 적 없다.', '나의 친구는 배구를 좋아한다. 나는 배구경기를 본 적 있다.', '나는 배구경기가 재미있었다.', '나는 테니스 경기를 본 적 없다.']"
K2-21688-CL13230-CP26015-16-04-S2.json,"['안녕, 나는 20대 여자야. 반가워.', '나는 엄마아빠가 계시는데, 요즘 바빠서 가족들 얼굴 볼 시간이 없어. 그래서 요즘 매일 눈물이 나.', '응, 그래서 몸이라도 건강하게 살려고 요즘 와인을 끊었어.', '나는 요즘 가야금을 연주해. 둘 다 좋은 취미네.', '그렇군. 혹시 전공은 뭐야? 난 국어국문학 전공이야.', '그러시군. 자기개발을 하는 중인가봐.']","['나는 바빠서 가족들 얼굴 볼 시간이 없어서 요즘 매일 눈물이 난다.', '나는 요즘 와인을 끊었다.', '나는 가야금 연주를 요즘 배운다.', '나는 국어국문학을 전공 중이다.']"
K2-09215-CL20357-CP22083-14-02-S2.json,"['안녕, 난 20살 남자야. 추석은 잘 보냈어?', '서울 살아서 전 멀리 가진 않았는데, 어디 다녀왔어?', '무엇을 타고 갔어? 뉴스를 보면 도로가 막히는 것 같던데.', '명절 때 이렇게 한꺼번에 내려가는 문화는 이제 없어져도 될 것 같은데, 나는 지난달부터 일하기 시작했어. 일해?', '아, 난 웹개발자로 일해. 난 다행이 요즘 개발자들이 부족해서 다른 친구들보다는 빨리 했어.', '효자네. 난 아직 부모님이랑 같이 살고 있어. 혼자 사는 게 부럽네.', '장점이 있는 반면에 단점도 있어. 요즘 귀가 아파. 좋아하는 음식이 있어? 곧 점심시간이야.', '오, 나랑 입맛이 비슷하네. 난 점심으로 김치찌개를 먹어야겠어. 칼칼한게 먹고싶네. 점심 맛있게 먹어. 다음에 다시 이야기하자.']","['나는 서울에 산다.', '나는 지난달부터 일을 다니기 시작했다.', '나는 웹 개발자이다.', '나는 아직 부모님과 같이 살고 있다.']"
K2-26023-CL30138-CP31232-09-07-S2.json,"['안녕, 나도 30대 남자야. 안녕.', '나는 자동차 정비일을 해. 좋아하는게 있어?', '나는 한달에 한번은 꼭 국내 여행을 다녀. 그게 참 좋아.', '그러시구나. 나도 시를 읽으면서 가끔 멀리 떠나는 상상을 해. 가끔이지만 시를 읽으면 참 좋아.', '그러면 오늘은 밥은 먹었어? 나는 술 약속이 있는데.', '아, 그렇구나. 술을 먹고 냉면을 먹으면 정말 좋은데.', '맞아. 오늘은 그럼 이제 술을 먹으러 가자.']","['나는 자동차 정비원이다.', '나는 한 달에 한 번은 꼭 국내 여행을 간다.', '나는 시를 가끔 읽는다. 나는 가끔 멀리 떠나는 상상을 한다.']"
K2-00898-CL40537-CP12726-15-01-S2.json,"['안녕, 나는 10대 여성이야.', '안녕, 난 아직 학생이지만 나중에 회사원이 되고 싶어.', '응, 고등학생이야. 난 매일 걸어서 학교에 가.', '나는 요새 게임을 배우고 있는데, 내 마음대로 안 되면 짜증이 나. 총 게임을 배우고 있어.', '네, 내 주위에도 롤플레잉 게임을 많이 해. 나는 지금 친구가 빵을 줬는데 원래 빵을 안 먹어서 다른 친구에게 줘야겠어.', '설거지가 너무 귀찮아. 식기세척기가 있으면 좋겠어.', '응, 주말에는 해. 평일에는 학교 끝나고 집에 가면 11시가 넘어서 그냥 바로 자는 편이야.', '네 조언 고마워. 나는 이만 공부하러 가야겠다.']","['나는 학생이다.','나는 나중에 회사원이 되고 싶다.', '나는 고등학생이다. 나는 매일 걸어서 학교에 간다.', '나는 총 게임을 배우고 있다. 나는 마음대로 안되면 짜증이 난다.', '나의 지인들 중에는 롤플레잉 게임을 많이 한다.','나는 빵을 안 먹는다.', '나는 식기세척기가 있으면 좋을 것 같다.', '나는 학교가 끝나고 집에 가면 11시가 넘어서 바로 자는 편이다.']"
K2-34953-CL42217-CP13556-05-02-S2.json,"['와, 나는 10대 여자야. 반가워.', '와, 난 컴퓨터 하드웨어 기술자가 되고 싶어. 우리 동종업계에서 일할 수도 있어.', '아버지가 약사여서 조금 아는데, 그러면 꾸준히 약을 복용해야 하지 않아?', '나는 A형이야. 그 때문에 매우 꼼꼼하다는 소리를 들어. 너는?', '난 꼼꼼하다 못해 수박을 자를 때 씨를 칼로 다 발라 둬. 과일 중에 수박을 제일 좋아해서, 맛있는 상태로 먹고 싶거든.', '난 뼈 있는 치킨을 좋아하는데, 우리 취향이 반대인가 보네. 혹시 음악은 뭐 좋아해? 난 트로트 음악을 좋아해.', '좋아하는 가수가 있으면 말해줘. 지금부터 들으면서 운동하러 잠시 나갈게. 다녀올게.']","['나는 컴퓨터 하드웨어 기술자가 되고 싶다.', '나의 아버지는 약사이다.', '나는 A형이다. 나는 매우 꼼꼼하다.', '나는 수박을 좋아한다.', '나는 뼈 잇는 치킨을 좋아한다.', '나는 트로트 음악을 좋아한다.']"
K2-33756-CL24180-CP24439-05-02-S2.json,"['안녕, 2주일 동안 잘 지냈어? 병원은 바빠?', '나는 오늘도 카페라떼를 테이크아웃해서 마시고 있어. 지금 남자친구 면회를 가.', '응 군대에 갔는데 복무 기간이 얼마 안남아서 너무 좋아.', '지금 6개월정도 남았어. 시간이 빨리 갔으면 좋겠네. 오늘도 병원이야?', '아 맞다. 쉰다고 했지. 오늘 계획은 있어?', '그러네. 바이올린 연주 너무 멋진거 같아.', '중국어에 관심이 있어? 쉬면서도 바쁘네. 그럼 또 연락할게.']",['[no_persona]']
K2-29356-CL11111-CP42083-16-03-S2.json,"['안녕, 난 10대 여성이야.', '어느 지역에 살아? 나는 수원에 살아.', '멋진 직업이네. 부지런해야 할 것 같아. 나는 성격이 다소 부지런해.', '책을 읽으려고 노력해. 멋진 습관이네. 좋아하시는 음식은 뭐야?', '나는 피자를 즐겨 먹어. 음악을 정말 좋아하나봐.', '그러시구나. 나는 ccm을 좋아해. 왠지 마음이 평안해져서.', '종교 없이 들어도 그냥 마음 편안해지고 좋더라. 나는 점심에 피자를 먹을까봐.']","['나는 수원에 산다.', '나는 성격이 다소 부지런하다.', '나는 책을 읽으려고 노력한다.', '나는 피자를 즐겨 먹는다.', '나는 종교가 없어도 ccm을 들으면 마음이 편안해지고 좋다.']"
K2-08997-CL42202-CP34399-06-05-S2.json,"['안녕, 나는 30대 여성이야.', '나는 약사로 일하고 있어. 그럼 보통 쉬는 날에는 뭐해?', '나도 친구와 거의 만나지 않아서 혼자 산책을 많이 하는 것 같아.', '그래서 산책을 좋아해. 나는 A형이야.', '산책말고는 주로 헬스장 가서 혼자 운동하는 것도 좋아해.', '맞아, 가끔은 혼자서 하면 심심할 때도 있었어.', '응, 대화 즐거웠어. 나도 일이 바빠서 가봐야 할 것 같아.']","['나의 직업은 약사이다.', '나는 친구를 거의 만나지 않는다.','나는 혼자 산책한다.', '나는 산책을 좋아한다.','나는 A형이다.', '나는 헬스장에서 혼자 운동하는 것을 좋아한다.', '나는 혼자 운동하면 심심할 때도 있다.']"
K2-26913-CL21758-CP22554-16-04-S2.json,"['선생님, 공부는 잘 되고 있어?', '내가 선생님의 공부를 방해한 걸까?', '다행이네. 나는 요즘 고민이 하나 있어.', '내가 먹을 것에 돈을 쓰는 것을 정말 좋아해.', '하도 사먹어서 다이어트를 해야할 것 같아.', '응, 오늘 몸무게를 쟀는데 앞자리가 달라졌어.', '내가 또 운동하는 걸 싫어해.', '필라테스요? 나중에 한 번 해봐야겠네. 고마워.']","['나는 먹을 것에 돈 쓰는 것을 좋아한다.', '나는 다이어트를 해야 할 것 같다.', '나는 운동을 싫어한다.']"
K2-21062-CL22037-CP51872-06-17-S2.json,"['5주만에 뵙네요. 별일 없었어? 난 자기계발서를 좋아해서 책을 읽으며 지냈어.', '환절기라 그래. 병원에는 가봤어?', '다행이네. 요즘 관심사가 뭐야?', '나는 교육 대학원을 들어갈지 고민이야.', '유아교육으로 전공을 바꿀까 해서.', '나도 아이들을 좋아해서 전공을 바꿔볼까 해.', '혹시 전직을 생각해 본 적 있어?']","['나는 교육대학원을 들어갈지 고민이다', '나는 유아교육으로 전공을 바꿀까 한다', '나는 아이들을 좋아해서 전공을 바꿔보려 한다']"
K5-01579-CL70017-CP80017-21-02-S2.json,"['밥을 먹고 왔더니 4시간이나 지났네. 너는 뭐하고 있었어?', '응, 항상 식단을 유지하다보니 오늘도 샐러드를 먹었어. 너는 뭐 먹었어?', '그럼. 내가 아는 선에서 뭐든지 대답 해 줄게.', '올해 대표적인 컬러는 시즌별로 다른데, S/S 시즌 부터 알려줄까?', '오 감이 좋으신데? S/S 시즌은 화려한 네온과 순백의 화이트 색이 대표적이었어. 그럼 깜짝퀴즈 나갑니다! F/W 시즌은 무슨 색이 대표적일까요?', '맞아, F/W 시즌에는 형광펜으로 칠한 것 같은 하이라이트 컬러가 장악했어. 비비드 컬러들이 트렌드였어.', '아직 1학년이니 잘 모르는게 당연해. 그럼 퀴즈 하나 더 나간다. 올해의 트렌드 패턴은 무엇일까?', '이번엔 맞췄네. 올해는 플라워 패턴과 체크 패턴이 경쟁이 붙었어.', '샤넬, 버버리, 르메르가 클래식하면서도 단정한 체크 팬츠를 내놓았고, 상반된 매력을 지닌 발렌시아가, 파코라반이 생동감 넘치고 빈티지한 플라워 패턴을 앞세웠어.', '나는 단정한 스타일을 좋아해서 체크패턴이 더 마음에 들었어. 너는 무슨 패턴이 더 마음에 들어?', '아 그러시구나! 나랑 반대시네. 그래도 내가 보는 눈은 있으니, 다음에 쇼핑 갈 때 같이 가서 봐줄게.', '그럼 연락 기다릴게. 아 궁금한 점이 없으면 나는 다른 일을 보고 와도 될까?']",['나는 단정한 스타일을 좋아한다. 나는 체크패턴이 마음에 든다.']
K2-07224-CL24110-CP34065-14-03-S2.json,"['안녕, 나는 사회복지사인 20대 여자야.', '나는 TV드라마를 좋아해서 지금 보고있어. 너는 뭐해?', '오 평소에도 캠핑 하는 걸 좋아해?', '나도 캠핑하는거 좋아해. 너는 캠핑가서 요리도 직접 해?', '내가 싱거운 음식을 좋아해서 내 입맛 위주로 요리해. 그래서 엄청 욕얻어 먹어.', '나는 찌개같은 한식을 좋아해. 너는 좋아하는 음식이 있어?', '오 나도 과일 좋아해! 무슨 과일을 제일 좋아해?', '나는 사과를 좋아해. 너는 반려동물을 키워?', '나는 토끼 한 마리를 키워. 밥 주고 올게.']","['나는 사회복지사이다.', '나는 TV 드라마를 좋아한다.', '나는 캠핑을 좋아한다.', '나는 싱거운 음식을 좋아한다.', '나는 한식을 좋아한다.', '나는 과일을 좋아한다.', '나는 토끼 한 마리를 키운다.']"
K2-15954-CL01521-CP01354-06-07-S2.json,"['오랜만이야. 그동안 공부하느라 연락을 못했어. 자격증 시험은 잘 쳤어.', '응, 결과는 다음주에 나오지만 아마 합격한 것 같아. 문제가 쉬웠어.', '나는 지금 수필책을 읽고 있어. 수필이 재밌어서 가끔 읽는 편이야. 수필 좋아해?', '그러시구나. 여행도 나도 좋아하는데 여러 자격증 공부하느라 못 간지 오래됐어.', '이탈리아는 좋지. 고마워. 하지만 아직 자격증 시험이 하나 남아있어.', '좋은 곳인데, 아마 바로 취업해야 할 거야.', '국내 여행은 괜찮겠네. 저번에 말했던 포토샵 자격증 공부는 어떻게 돼가고 있어?', '그래도 잘 해낼거야. 포토샵은 사진 보정하는 프로그램이야? 나는 사진 찍는게 지루해서 관심이 없어.', '아 그렇군. 다음에 나도 도전해볼까?', '응, 그럼 화이팅 열공해!']","['나는 수필을 가끔 읽는다.', '나는 여러 자격증 공부하느라 좋아하는 여행을 못 간지 오래됐다.', '나는 바로 취업을 해야 할 것이다.', '나는 사진 찍는 것이 지루하다.']"
K2-24626-CL01873-CP02692-16-12-S2.json,"['안녕, 난 20대 여자야.', '안녕, 어떤 일 하는 중이야?', '나는 미용사야. 가게에서 일하고 있어.', '응, 너는 형제가 있어? 나는 오빠가 있어.', '제 오빠는 기자인데 사회면에서 일해. 멋지지 않아?', '아, 진짜? 검사라니 멋있다.', '정말이야? 일이 정말 힘들겠다.', '꼭 먹어야 해. 머리 까진 남자는 정말 별로야. 또 연락할게.']","[ '나는 미용사이다.', '나의 남자 형제는 기자이다.']"
K2-09266-CL21581-CP22179-09-06-S2.json,"['다녀왔어. 청소는 다 했어?', '원래는 그럴려고 했는데, 강아지 산책시키는 걸 까먹어서 얼른 나갈 준비를 하려고 해.', '그렇지, 안해주면 아주 지랄발광을 떨어대서 꼭 해줘야 해.', '휴지를 다 뽑아놓고 문을 긁고 빨래통을 뒤엎는 걸 봐버려서 그만... 험한 말을 해버렸네...', '너무 태세 전환이 빠르지 않아?', '우리 애기도 좀 그런 유연함을 본받아서 언니가 바빠서 산책갈 여를도 없구나 납득해줬으면 좋겠네.', '우문현답이네. 그래도 산책을 안시키면 강아지도 답답할테니까 다녀와야지.', '그러면 나는 에너지를 좀 뽑아내고 올게.']","['나의 강아지는 산책을 안 가면 지랄발광을 떤다.', '나의 강아지는 사고를 많이 친다.', '나는 산책을 안 하면 강아지가 답답할 것 같다고 생각한다.']"
